english,german,similarity
"72.71 16.78 11.14 6.16 255 Dividend per share € 3.50 (36.4) % 5.50 3.80 2.00 1.75 34 Total dividend €mn 1,586 (35.9) % 2,476 1,642 811 674 34 Share price as of December 31 € 75.00 (49.3) % 147.95 154.76 127.94 97.60 33 Market capitalization as of December 31 €mn 33,979 (49.0) % 66,600 66,880 51,949 35,936 35 Other Data Return on equity after income tax”) % 9.79) (5.3) pts 15.0% 15.0% 12.9 78 Third-party assets under management as of December 31 €mn 703,478 (8.0) % 764,621 763,855 742,937 584,624 66 Employees 182,865 0.9% 181,207 166,505 177,625 176,501 1 Total revenues comprise Property-Casualty segment’s gross premiums written, Life/Health segment’s statutory premiums, Banking segment’s operating revenues and Asset Management segment’s operating revenues.","17,71 16,78 11,14 6,16 266 Dividende je Aktie € 3,50 -36,4% 5,50 3,80 2,00 1,75 35 Dividendensumme Mio € 1586 -35,9% 2476 1642 811 674 35 ‚Aktienkurs zum 31.",0.862509548664093
3) The Allianz Group uses operating profit to evaluate the performance of its business segments and the Group as a whole.,"3) Die Allianz Gruppe verwendet das operative Ergebnis, um die Leistung ihrer Segmente und die der Gruppe als Ganzes zu beurteilen.",0.8535057902336121
"With nearly 153,000 employees, the Allianz Group serves approximately 75 million customers in about 70 countries.",Mit fast 153 000 Mitarbeitern bedienen wir rund 75 Millionen Kunden in etwa 70 Ländern.,0.8695152997970581
"— Strong operating profit of € 5,649 million largely unaffected by financial market crisis.",– Das starke operative Ergebnis von 5 649 Millionen Euro blieb von der Finanzmarktkrise weitgehend unberührt.,0.9044492840766907
– Combined ratio of 95.1 % close to our target.,"– Die Combined Ratio lag mit 95,1 Prozent im Rahmen unserer Zielvorgaben.",0.8952279090881348
"— Operating profit of € 1,206 million despite financial markets turmoil.",– Trotz der Finanzmarktverwerfungen erzielten wir ein opera- tives Ergebnis von 1 206 Millionen Euro.,0.8685418367385864
– Sale of Dresdner Bank completed.,– Der Verkauf der Dresdner Bank wurde abgeschlossen.,0.9453744888305664
"Following the sale of Dresdner Bank, we focus in the banking business on our core market Germany under the brand name “Allianz Bank”.",Nach dem Verkauf der Dresdner Bank fokussieren wir uns im Bankgeschäft unter der Marke „Allianz Bank“ auf den Kern- markt Deutschland.,0.9329996109008789
Under the roof of Oldenburgische Landesbank we will offer various banking services to our customers.,Unter dem Dach der Oldenburgischen Landesbank werden wir unseren Kunden verschiedene Bank- dienstleistungen anbieten.,0.9710072875022888
Outside Germany we are represented with our assurbanking in selected regions.,Außerhalb Deutschlands sind wir mit unserem „Assurbanking“ in ausgewählten Regionen vertreten.,0.8682934641838074
— Continuing banking operations recorded an operating loss of €31 million.,– Das fortzuführende Bankgeschäft erzielte einen operativen Verlust von 31 Millionen Euro.,0.8944293260574341
"2008 2007 2006 Operating revenues €mn 544 622 604 Operating profit €mn (31) 32 63 Net income (loss) from continuing operations €mn (114) 55 69 Cost-income ratio % 100.4 94.1 90.1 2008 2007 2006 _Operating revenues €mn 2,887 3,259 3,044 Operating profit €mn 926 1,359 1,290 Net income €mn 379 498 404 Cost-income ratio % 67.9 58.3 57.6 Operating revenues by regions 3) in % Third-party assets under management by regions 6) in % New Europe: 7.9 a Germany: Italy: 32.4 Other”: 4.4 (5.2) — Asia-Pacific: 7.4 (8.4) ____ =>, Germany: 12.1 (15.0) — Rest of Europe: 17.1 (15.2) United States: 59.0 (56.2) ___— 2) Following the sale of almost all of Dresdner Bank to Commerzbank, our Banking segment reflects our existing banking operations as well as Oldenburgische Landesbank and the banking clients from Dresdner Bank introduced through our tied agents channel.","2008 2007 2006 Operative Erträge Mio € 544 622 604 Operatives Ergebnis Mio€ -31 32 63 Jahresüberschuss (-fehlbetrag) aus fortzuführenden Geschäftsbereichen Mio€ -114 55 69 Cost-Income Ratio % 100,4 94,1 90,1 2008 2007 2006 Operative Erträge Mio € 2887 3259 3044 Operatives Ergebnis Mio € 926 1359 1290 Jahresüberschuss Mio € 379 498 404 Cost-Income Ratio % 67,9 58,3 57,6 Operative Erträge nach Regionen 3) in % Kapitalanlagen für Dritte nach Regionen 6) in % New Europe: 7,9 ___ | Italien: 32,4 Sonstige”): 4,4 (5,2) ‚Asien-Pazifik: 7,4 (8,4) Deutschland: 12,1 (15,0) _Übriges Europa: 17,1 (15,2) USA: 59,0 (56,2) 2) Aufgrund des nahezu vollständigen Verkaufs der Dresdner Bank an die Commerzbank weisen wir in unserem Banksegment unsere bestehenden Bankgeschäfte sowie die Oldenburgische Landesbank und die Bankkunden der Dresdner Bank, die durch Vertreter der Allianz Gruppe geworben wurden, aus.",0.8780032992362976
3) Our banking activities in France recorded € (0.3) million operating revenues in 2008.,"») Das Bankgeschäft in Frankreich verzeichnete - 0,3 Mio € in den operativen Erträgen 2008.",0.8593032956123352
"Allianz Group Annual Report 2008 Letter to the Shareholder For Allianz, 2008 was a year of market upheavals, a test of our business model and the sale of Dresdner Bank.","Geschäftsbericht Allianz Gruppe 2008 Aktionärsbrief für Ihre Allianz war 2008 ein Jahr der Marktverwerfungen, der Prüfung unseres Geschäftsmodells und des Verkaufs der Dresdner Bank.",0.9570788741111755
Turbulence.,Turbulenzen.,0.9654715657234192
It was much worse than expected.,Es kam weit schlimmer als erwartet.,0.9205955862998962
"And it is no longer just companies being af- fected —in 2009, the crisis will hit consumers, the people who buy our products, hard.","Nach den Unternehmen trifft die Krise 2009 auch die Konsumenten hart, die Menschen, die unsere Produkte kaufen.",0.8535109162330627
Test of our business model.,Prüfung unseres Geschäftsmodells.,0.9271861910820007
Our operating business remains stable.,Unser operatives Geschäft ist weiter stabil.,0.9551138877868652
Sale of Dresdner Bank.,Verkauf der Dresdner Bank.,0.9538888931274414
The financial and economic crisis hit Dresdner Bank harder than any other part of the Allianz Group.,Am stärksten in der Allianz Gruppe traf die Finanz- und Wirtschafts- krise die Dresdner Bank.,0.8662775754928589
"At our 2008 General Meeting, I said that the results on the banking side had not reached the quality of our other operating segments and announced discussions targeting the Allianz Group Annual Report 2008 Letter to the Shareholder creation of competitive market share in Germany for private banking institutions and the sharp swings in investment banking.","Ich hatte auf unserer Hauptversammlung Geschäftsbericht Allianz Gruppe 2008 Aktionärsbrief 2008 gesagt, dass die Ergebnisse im Bankgeschäft nicht die Qualität unserer anderen Geschäfts- segmente erreichen und kündigte Gespräche an mit dem Ziel, in Deutschland für private Bank- institute wettbewerbsfähige Marktanteile zu bilden.",0.8803499937057495
"You, as shareholders, agreed and demanded that Dresdner Bank be placed in a sustainable and successful constellation.","Sie als Aktionäre hatten zugestimmt und gefordert, die Dresdner Bank in eine nachhaltig erfolgreiche Konstellation einzubringen.",0.8784316182136536
We fulfilled this task under extremely difficult conditions.,Diese Aufgabe haben wir unter schwierigsten Rahmenbedingungen erfüllt.,0.8846210837364197
With the sale of Dresdner Bank to Commerzbank we found a solution that was fair to all the institutions involved.,"Mit dem Verkauf der Dresdner Bank an die Commerzbank wurde eine Lösung gefunden, die allen Instituten gerecht wird.",0.8895898461341858
Commerzbank and Dresdner Bank have much greater prospects for future growth working together.,Commerzbank und Dresdner Bank erschließen sich gemeinsam eine deutlich tragfähigere Zukunfts- und Wachstumsperspektive.,0.8786035180091858
"However, it should not be overlooked that in both 2006 and in the first half of 2007, Dresdner Bank notched up the best results in its long history prior to the crisis which sent banks’ market values tumbling both here in Germany and abroad.","Dabei muss aber auch gesehen werden, dass die Dresdner Bank 2006 und auch im ersten Halbjahr 2007 die besten Ergebnisse ihrer langen Geschichte erzielt hat, bevor die Krise begann, die bei allen Banken in Deutschland und im Ausland Marktwertverluste in ungeahnter Höhe verursacht hat.",0.8640839457511902
"In my view, the swift reaction and the timely closure of a transaction with an industrial logic in such a market situation was a positive achievement for Allianz share- holders.",Die schnelle Reaktion und der zeitnahe Abschluss einer Transaktion mit einer industriellen Logik in einer solchen Marktsituation ist nach meiner Einschätzung für die Allianz Aktionäre positiv zu sehen.,0.8935808539390564
That is why we are retaining our integrated advisory approach in the private client segment following this transaction.,Deshalb bleibt auch nach der Transaktion unser integrierter Beratungs- ansatz im Privatkundensegment bestehen.,0.8523262739181519
"We will leverage the reciprocal exchange of knowledge and experience between Allianz and Dresdner Bank over the last seven years, for the global distribution of our insurance products through our 200 bancassurance partners.","Den wechselseitigen Erfahrungs- und Wissensaus- tausch, der in den letzten sieben Jahren zwischen Allianz und Dresdner Bank stattgefunden hat, nutzen wir weltweit für den Vertrieb unserer Versicherungsprodukte über rund 200 Bankpartner- schaften.",0.8906674981117249
This is clearly a great disappointment.,Dies ist ganz klar eine große Enttäuschung.,0.9183952212333679
"With our dividend proposal of € 1,586 million or € 3.50 per share we are endeavoring to take into account both our earnings performance and the need for an appropriate capital base as well as your justified interest in an attractive dividend.","Mit unserem Dividendenvorschlag von 1 586 Millionen Euro oder 3,50 Euro je Aktie versuchen wir, der Ergebnisentwicklung und den Anforderungen an eine angemessene Kapital- ausstattung einerseits und Ihrem berechtigten Interesse an einer attraktiven Dividende anderer- seits Rechnung zu tragen.",0.8767757415771484
Risk management and investment of capital are of particular importance this year.,Besondere Bedeutung hat in diesem Jahr das Risikomanagement und die Kapitalanlage.,0.9228530526161194
These statements are of course supported by programs and processes which we describe in full in the chapter Strategy on the pages 30 to 32 of this Annual Report.,"Natürlich stehen hinter diesen Aussagen Programme und Prozesse, die wir in dem Kapitel Strategie auf den Seiten 30 bis 33 dieses Geschäftsberichts beschreiben.",0.8743098974227905
Dr. Perlet has contributed significantly to making Allianz what it is today.,"Herr Dr. Perlet hat wesentlich dazu beigetragen, die Allianz, wie wir sie heute kennen, zu formen.",0.8505111932754517
"In Supervisory Board meetings, on the basis of reporting from the Board of Management, we discussed in detail the development of the business and important decisions and business matters.",Auf der Grundlage der Berichterstattung des Vor- stands erörterten wir in den Aufsichtsratssitzungen aus- führlich die Geschäftsentwicklung sowie für das Unterneh- men wichtige Entscheidungen und Vorgänge.,0.8982135057449341
"Furthermore we dealt with the Board of Management’s planning for the 2009 financial year and medium-term planning, as well as with deviations from plans in the course of the business.",Außerdem befassten wir uns mit der Planung des Vorstands für das Geschäftsjahr 2009 und der mittelfristigen Planung sowie mit den Abweichungen des tatsächlichen Geschäftsverlaufs von den Planungen.,0.9170457124710083
The Supervisory Board met in total five times during the 2008 financial year.,Im Geschäftsjahr 2008 trat der Aufsichtsrat zu insgesamt fünf Sitzungen zusammen.,0.8522334098815918
"The ordinary meetings were held in March, May, September and December.","Die regulären Sitzungen fanden im März, im Mai, im September und im Dezember statt.",0.9217916131019592
"In August 2008, the Supervisory Board also held an extraordinary meeting in relation to the sale of Dresdner Bank AG to Commerzbank AG.",Ferner hielt der Aufsichtsrat im August 2008 eine außer- ordentliche Sitzung im Zusammenhang mit dem Verkauf der Dresdner Bank AG an die Commerzbank AG ab.,0.9282878041267395
"The Board of Management reports on the business situation and all the presentations on particular issues were accom- panied by written supporting documentation, all of which was sent to each Supervisory Board member prior to the meeting for preparation purposes.","Die Vorstandsberichte zur Geschäftslage und Referate zu besonderen Themen waren von schriftlichen Präsentatio- nen und Unterlagen begleitet, die jeweils vor der Sitzung zur Vorbereitung an jedes Aufsichtsratsmitglied geschickt wurden.",0.8692234754562378
Within our work on the Supervisory Board we put special emphasis on the worldwide crisis of financial and capital markets which has evolved in the aftermath of the turbu- lences on the U.S. real estate and mortgage market and which still persists.,"Einen wichtigen Schwerpunkt unserer Arbeit im Aufsichts- rat bildete die weltweite Finanz- und Kapitalmarktkrise, die sich in der Folge der US-amerikanischen Immobilien- und Hypothekenmarktturbulenzen entwickelte und weiter anhält.",0.8619307279586792
"On the basis of detailed reporting from the Board of Management, we further examined the consequences of the financial market crisis on Dresdner Bank and develop- ments in material legal proceedings.",Auf der Grundlage eines aus- führlichen Berichts des Vorstands haben wir weiter über die Folgen der Finanzmarktkrise für die Dresdner Bank und über die Entwicklung bei wesentlichen Rechtsstreitigkeiten beraten.,0.8603053092956543
"In particular, we dis- cussed with the Board of Management continuation of Dresdner Bank on a standalone basis in the Allianz Group, an offer by the Commerzbank and the possibility of the sale of Dresdner Bank to a foreign financial institution.","Insbesondere erörterten wir mit dem Vorstand die Weiterführung der Dresdner Bank auf Stand-alone-Basis im Allianz Konzern, ein vorliegendes Angebot der Commerzbank und die Möglichkeiten eines Verkaufs der Dresdner Bank an ein ausländisches Finanzinstitut.",0.9245815277099609
The Board of Management addressed the structure and condi- tions of the transaction and informed us in detail about the financial and operative effects on Dresdner Bank and the Allianz Group.,Dabei ging der Vorstand auf Struktur und Konditionen der Trans- aktion ein und informierte uns im Einzelnen über deren finanzielle und operative Auswirkungen auf die Dresdner Bank und die Allianz Gruppe.,0.8796177506446838
"In the meeting on September 11, 2008, we discussed in detail Corporate Governance in the Allianz Group and we specifically reviewed the changes to the German Corporate Governance Code made by the Government Commission in June 2008.",September 2008 diskutierten wir im Einzelnen die Corporate Governance in der Allianz Gruppe und setzten uns namentlich mit den von der Regierungs- kommission im Juni 2008 beschlossenen Änderungen des Deutschen Corporate Governance Kodex auseinander.,0.8558439612388611
"On the basis of a thorough presentation by the Chairman of the Board of Management, we dealt with the strategic direction of the Allianz Group and the different business segments, with specific emphasis on the German and international outlook for the life in- surance business.",Auf der Grundlage eines ausführlichen Referats des Vorstandsvorsitzenden befassten wir uns mit der strategischen Ausrichtung der Allianz Gruppe und der verschiedenen Geschäftsbereiche und vertieften dabei vornehmlich die Perspektiven des Lebensversicherungsge- schäfts in Deutschland und auf internationaler Ebene.,0.875655472278595
"Previously, all members of the Supervisory Board were surveyed in writing on important aspects of the Supervisory Board’s work.",Zuvor waren alle Aufsichtsratsmitglieder schriftlich zu wichtigen Aspekten der Aufsichtsratsarbeit befragt worden.,0.8574950695037842
"In addition to regular reporting over the course of business and the situation of the Allianz Group, we also addressed planning for the 2009 financial year as well as medium- term planning, and issued a declaration of compliance with the German Corporate Governance Code.",Neben der regelmäßigen Berichterstattung über den Geschäftsverlauf und die Lage der Allianz Gruppe behandelten wir die Planung für das Geschäftsjahr 2009 sowie die Mittelfristplanung und gaben die Entsprechenserklärung zum Deutschen Corporate Governance Kodex ab.,0.8937007784843445
"The Board of Management also reported on Allianz Group’s financial investment in the Hartford Financial Services Group, an American financial services company.",Darüber hinaus berichtete der Vorstand über das Finanzinvestment der Allianz Gruppe bei dem US- amerikanischen Finanzdienstleister The Hartford Financial Services Group.,0.9442107081413269
"Allianz SE is in compliance with all recommendations of the June 6, 2008 version of the Government Commission German Corporate Governance Code.",Juni 2008 befolgt die Allianz SE sämtliche Empfehlungen der Regierungskommission Deut- scher Corporate Governance Kodex.,0.8576376438140869
"In an additional meet- ing in November 2008, which was held jointly with the Risk Committee and with the presence of the other members of the Supervisory Board, the committee once again dealt primarily with the integration of Dresdner Bank with Commerzbank and the effects of the capital market crisis.","In einer zusätz- lichen Sitzung im November 2008, die gemeinsam mit dem Risikoausschuss und unter Anwesenheit auch der übrigen Aufsichtsratsmitglieder abgehalten wurde, behandelte der Ausschuss noch einmal schwerpunktmäßig die Integration der Dresdner Bank in die Commerzbank sowie die Auswir- kungen der Kapitalmarktkrise.",0.8837948441505432
"The Personnel Committee prepared the regular review of the Board of Management’s remuneration system, including the main elements of the contract, at the December meet- ing of the Supervisory Board and the adoption of resolutions regarding the remuneration system.",Die regelmäßige Überprüfung des Vergütungssystems für den Vorstand einschließlich der wesentlichen Vertragselemente in der Dezember-Sitzung des Aufsichtsrats sowie die Beschlussfassung über das Vergütungssystem bereitete der Personalausschuss vor.,0.9183416962623596
"The Audit Committee held five meetings in financial year 2008, in February, March, May, August and November.","Der Prüfungsausschuss hielt im Geschäftsjahr 2008 fünf Sitzungen ab, die im Februar, im März, im Mai, im August und im November stattfanden.",0.9409449696540833
The half year financial report and the other quarterly financial state- ments were also reviewed by KPMG.,Ebenfalls wurden der Halbjahresfinanzbericht und die übrigen Quartalsabschlüsse durch die KPMG einer prüferi- schen Durchsicht unterzogen.,0.8557748198509216
The Supervisory Board thanked Dr. Walter for his successful work for the Allianz Group.,Der Aufsichtsrat hat Herrn Dr. Walter für seine erfolgreiche Tätigkeit für die Allianz Gruppe gedankt.,0.9501099586486816
"The Supervisory Board appointed Mr. Oliver Bäte to the Board of Management effec- tive January 1, 2008.",Januar 2008 hat der Aufsichtsrat Herrn Oliver Bäte in den Vorstand berufen.,0.9055647850036621
"For this reason it is important that the existing Corporate Governance structures are constantly reviewed and developed further, whenever necessary.","Deshalb ist es wichtig, dass die bestehenden Corporate-Governance-Strukturen ständig überprüft und soweit nötig fortentwickelt werden.",0.8713225722312927
"Corporate constitution of the European Company As a European Company, Allianz SE is, in addition to Ger- man stock corporation law, also subject to special European SE regulations and the German law implementing the Euro- pean Company.",Als Europäische Aktiengesellschaft unterliegt die Allianz SE zusätzlich zum deutschen Aktienrecht den speziellen euro- päischen SE-Regelungen und dem deutschen SE-Ausfüh- rungsgesetz.,0.8626852035522461
The Board of Management manages Allianz SE and Allianz Group.,Der Vorstand leitet die Allianz SE und den Allianz Konzern.,0.8860417604446411
"It currently comprises 10 members from different countries, making it as international as Allianz itself.","Er umfasst zurzeit zehn Mitglieder aus unterschiedlichen Ländern, ist also international wie die Allianz selbst.",0.9395685195922852
This agreement can be found on our website under www.allianz.com/se.,Diese Vereinbarung finden Sie auf unserer Internet- seite unter www.allianz.com/se.,0.8704546689987183
"In accordance with the Agreement Concerning the Partici- pation of Employees in Allianz SE, the seats for the six em- ployee representatives are arranged in proportion to the number of Allianz employees in the EU member states.",Nach der Vereinbarung über die Beteiligung der Arbeitneh- mer in der Allianz SE sind die sechs Sitze der Arbeitnehmer- vertreter nach dem Verhältnis der Anzahl der Allianz Arbeit- nehmer in den EU-Mitgliedstaaten zu verteilen.,0.8543335199356079
The last election of the Supervisory Board took place in 2007 for a term until the end of the ordinary General Meeting in 2012.,Die letzte Wahl des Aufsichtsrats erfolgte 2007 für eine Amtszeit bis zum Ablauf der ordentlichen Hauptversammlung 2012.,0.9242826104164124
A part of the Supervisory Board’s activities is delegated to the following committees of the Supervisory Board.,Ein Teil der Aufsichtsratstätigkeit wird durch folgende Aus- schüsse des Aufsichtsrats wahrgenommen.,0.9351580142974854
The Personnel Committee is responsible for personnel matters concerning members of the Board of Management.,Der Personalausschuss ist für die Personalangelegenheiten der Vorstandsmitglieder zuständig.,0.8872658610343933
It is the Personnel Committee’s duty to prepare such resolutions and reviews and to determine the details of the remuneration.,"Der Personalausschuss hat die Aufgabe, diese Beschlussfassungen und Überprüfungen vorzubereiten und Einzelheiten der Vergütung festzulegen.",0.8761009573936462
"tives, General Meetings are bound by the proposals of the employees.",Die Hauptversammlung ist an die Vorschläge der Arbeitnehmer gebunden.,0.8607928156852722
"Unless at least half of the share capital is represented in adopting a resolution on a change to the Statutes, such resolutions require a majority of at least two thirds of the votes cast, in accordance with Euro- pean regulations and the Statutes.","Sofern bei der Beschlussfassung über eine Satzungsänderung nicht mindestens die Hälfte des Grund- kapitals vertreten ist, bedarf es nach europarechtlichen Vorgaben und der Satzung einer Beschlussmehrheit von mindestens zwei Drittel der abgegebenen Stimmen.",0.8606078624725342
"Allianz Group accounts comply with international account- ing standards, in particular the International Accounting Standards (IAS) and the International Financial Reporting Standards (IFRS) as published by the International Account- ing Standards Board (IASB).","Die Rechnungslegung des Allianz Konzerns erfolgt auf der Grundlage der internationalen Rechnungslegungsstandards, insbesondere der International Accounting Standards (IAS) und der International Financial Reporting Standards (IFRS) in der vom IASB veröffentlichten Fassung.",0.9464855194091797
"As the Allianz share is quoted on the New York Stock Exchange (NYSE), we are obliged to file an annual report on Form 20-F with the U.S. Securities and Exchange Commission (SEC), in accordance with the U.S. rules applicable to foreign issuers.","Als an der New York Stock Exchange (NYSE) notiertes Unternehmen sind wir überdies dazu verpflichtet, bei der US-amerikanischen Börsenaufsicht Securities and Exchange Commission (SEC) einen Geschäftsbericht („Form 20-F“) einzureichen, der den US-Regeln für ausländische Emittenten entspricht.",0.8592007160186768
Shareholders exercise their rights in General Meetings.,In der Hauptversammlung üben die Aktionäre ihre Rechte aus.,0.8697523474693298
We constantly promote the use of e-mail and Internet services.,Die Nutzung von E-Mail und Internetservices wird von uns nachhaltig gefördert.,0.9041818380355835
Members of the Supervisory Board are elected in General Meetings.,Die Hauptversammlung wählt die Mitglieder des Aufsichtsrats.,0.9266572594642639
"The German Risk Limitation Act (law on limiting risks aris- ing from financial investments, Risikobegrenzungsgesetz) of August 2008 also introduces new aspects to Corporate Governance.",Neuerungen im Bereich der Corporate Governance bringt darüber hinaus das im August 2008 verkündete Risikobe- grenzungsgesetz (Gesetz zur Begrenzung der mit Finanz- investitionen verbundenen Risiken) mit sich.,0.9306926727294922
"Further changes will be brought about by the law on the implementation of the EU Directive on shareholders rights (ARUG), which is currently in the legislative procedure.",Weitere Änderungen wird das im Gesetzgebungsverfahren befindliche Gesetz zur Umsetzung der EU-Aktionärsrechte- richtlinie (ARUG) bringen.,0.9011048078536987
