english,german,similarity
The improvements to IFRS project is an annual process that the IASB has adopted to deal with non-urgent but necessary amendments to IFRS (the ‘annual improvements process’).,"In dem Projekt zu den jährlichen Ver- besserungen an den IFRS ist ein jährlicher Prozess, den das IASB eingeführt hat, um sich mit nicht dringenden, aber notwendigen Ergänzungen zu den IFRS zu befassen („Pro- zess zur jährlichen Verbesserung“).",0.8926323056221008
Part I deals with changes the IASB identified resulting in accounting changes.,"Teil I befasst sich mit Änderungen, die das IASB als Änderungen in den Bilanzierungsmethoden identifiziert hat.",0.8562038540840149
IAS 39 Changes in circumstances relating to derivatives are not reclassifications.,IAS 39 Änderungen in den Umständen in Bezug auf Derivate sind keine Umgliederungen.,0.8760400414466858
"– the movements between different levels of the fair value hierarchy, and the reasons for those movements.",– Bewegungen zwischen den verschiedenen Stufen der Zeitwerthierarchie und die Gründe für solche Bewegungen.,0.8757456541061401
Earlier application is permitted.,Eine vorzeitige Anwendung ist erlaubt.,0.926119863986969
"IFRIC 13, Customer Loyalty Programmes In June 2007, the IFRIC issued IFRIC 13, Customer Loyalty Programmes.","Im Juni 2007 hat IFRIC den IFRIC 13, Kundentreueprogramme, veröffentlicht.",0.9030479788780212
Customers are implicitly paying for the points they receive when they buy other goods or services.,"Kunden bezahlen implizit für die Punkte, die sie erhalten, wenn sie andere Güter oder Dienstleistungen kaufen.",0.9038371443748474
"Therefore, IFRIC 13 requires companies to es- timate the value of the points to the customer and defer this amount of revenue as a liability until they have fulfilled their obligations to supply awards.","Daher verlangt IFRIC 13 von Unternehmen, den Wert der Punkte für die Kunden zu schätzen und diesen Betrag des Umsatzes als Verbindlichkeit zurückzustellen, bis das Unternehmen seine Verpflichtung zur Einlösung der Prämien erfüllt hat.",0.8932631611824036
Earlier application is permitted.,Eine vorzeitige Anwendung ist erlaubt.,0.926119863986969
"Allianz Group Annual Report 2008 Notes to the Consolidated Financial Statements IFRIC 15, Agreements for the Construction of Real Estate In July 2008, the IFRIC issued IFRIC 15, Agreements for the Construction of Real Estate.","IFRIC 15, Vereinbarungen über die Errichtung von Immobilien Im Juli 2008 hat IFRIC den IFRIC 15, Vereinbarungen über die Errichtung von Immobilien, veröffentlicht.",0.8620736598968506
Earlier application is permit- ted.,Eine vorzeitige Anwendung ist erlaubt.,0.9147912859916687
"IFRIC 18, Transfers of Assets from Customers In January 2009, the IFRIC issues IFRIC 18, Transfers of Assets from Customers.","IFRIC 18, Übertragungen von Vermögenswerten von Kunden Im Januar 2009 hat IFRIC den IFRIC 18, Übertragungen von Vermögenswerten von Kunden, veröffentlicht.",0.8998215198516846
"IFRIC 18 includes a clarification with regard to – the circumstances in which the definition of an asset is met, – the recognition of the asset and measurement of its cost on initial recognition, – the identification of the separately identifiable services, – the recognition of revenue, – the accounting for transfers of cash from customers.","In IFRIC 18 wird Folgendes klargestellt: – die Umstände, unter denen die Definition eines Vermögens- wertes erfüllt ist; – der Ansatz des Vermögenswertes und die Bemessung der Anschaffungskosten bei Zugangsbewertung; – die Identifikation separat identifizierbaren Dienstleistungen; – die Erfassung von Erlösen; – die Bilanzierung von Kunden übertragener Barzahlungen.",0.8505257964134216
Limited retrospective application is permitted.,Eine begrenzte rückwirkende Anwendung ist zulässig.,0.8727346658706665
Comparative infor- mation has not been adjusted in accordance with IFRS 5.,Vergleichsinformationen wurden gemäß IFRS 5 nicht angepasst.,0.9551295042037964
"Administrative expenses include personnel expenses, oper- ating expenses, and other administrative expenses.","Verwaltungsaufwendungen umfassen Personalaufwendungen, betriebliche Aufwendungen und andere Verwaltungsaufwendungen.",0.8876926898956299
Acquisition costs and administrative expenses are disaggregated according to segment and type of costs in Note 39.,Abschluss- und Verwaltungsaufwendun- gen werden in Angabe 39 in Segment und Kostenart aufge- gliedert.,0.8600706458091736
"In the first step, Commerzbank would acquire 60.2% of the shares in Dresdner Bank from Allianz.","Im ersten Schritt sollte die Commerzbank 60,2% der Aktien der Dresdner Bank von der Allianz erwerben.",0.9068410992622375
The expected stake that Allianz would have held in Commerzbank would have amounted to nearly 30%.,"Der erwartete Anteil, den die Allianz an der Commerzbank gehalten hätte, hätte nahezu 30% betragen.",0.9466737508773804
"On November 27, 2008, Allianz and Commerzbank agreed to accelerate the change in ownership of Dresdner Bank.",November 2008 haben sich die Allianz und die Commerzbank auf eine Beschleunigung des Eigentümer- wechsels der Dresdner Bank geeinigt.,0.8583824038505554
"With this new agree- ment, Dresdner Bank and Commerzbank should be able to merge approximately six to nine months earlier than origi- nally planned.",Mit dieser neuen Vereinbarung dürfte eine Verschmelzung von Dresdner Bank und Commerzbank ungefähr sechs bis neun Monate früher als ursprünglich geplant stattfinden.,0.9074611067771912
SoFFin will receive a 25% plus one share participation in Commerzbank shareholders’ equity.,Der SoFFin wird eine Beteiligung von 25% plus eine Aktie an der Commerzbank erhalten.,0.9274094104766846
Comparative infor- mation has not been adjusted in accordance with IFRS 5.,Vergleichsinformationen wurden gemäß IFRS 5 nicht angepasst.,0.9551295042037964
3) All numbers are stated on a consolidated basis.,3) Alle Zahlen werden nach Konsolidierung ausgewiesen.,0.8970166444778442
The companies listed in the table below are consolidated in addition to the parent company Allianz SE.,Neben der Allianz SE als Mutterunternehmen umfasst der Konsolidierungskreis die in untenstehender Tabelle aufge- führten Unternehmen.,0.8716851472854614
The Allianz Group controls these entities on the basis of shareholder agreements between the Allianz Group subsidiary owning 50% of each such entity and the other shareholders.,"Der Allianz Konzern kontrolliert diese Gesell- schaften auf der Grundlage von Managementvereinbarungen zwischen einer Tochter- gesellschaft des Allianz Konzerns, die jeweils 50,0% der Anteile an diesem Unternehmen hält, und den anderen Aktionären.",0.8612317442893982
"Furthermore, all management functions of these subsidiaries are performed by the employees of the Allianz Group and all operations are undertaken in Allianz Group’s facilities.","Außerdem werden alle Managementaufgaben dieser Konzernunternehmen von Mitarbeitern des Allianz Konzerns wahrgenommen, und alle Geschäfte werden in Einrichtungen des Allianz Konzerns getätigt.",0.9014672636985779
The Allianz Group also develops all insurance products written through these subsidiaries.,"Der Allianz Konzern entwickelt ferner alle Versicherungsprodukte, deren Zeichnung über diese Konzernunternehmen erfolgt.",0.9086568355560303
.,.,0.9999997019767761
.,.,0.9999997019767761
.,.,0.9999997019767761
.,.,0.9999997019767761
.,.,0.9999997019767761
"On July 18, 2006, the Allianz Group acquired 100.0% (Group share through indirect holder Roland Holding GmbH, Munich at the date of first-time consolidation: 65,0% ) of manroland AG, Offenbach, at a purchase price of € 554 mn.","Juli 2006 erwarb der Allianz Konzern 100,0% (Konzernanteil über haltende Gesellschaft Roland Holding GmbH, München zum Zeitpunkt der Erstkonsolidierung: 65,0%) der Anteile an manroland AG, Offenbach zum Kaufpreis von 554 Mio €.",0.9207108020782471
Manroland AG is the world’s second largest manufacturer of printing systems.,manroland AG ist der weltweit zweitgrößte Hersteller von Drucksystemen.,0.9287676215171814
"Thus, the Allianz Group’s segments are structured as Prop- erty-Casualty, Life/Health, Banking, Asset Management and Corporate.","Somit sind die Geschäftssegmente des Allianz Konzerns in die Segmente Schaden-Unfall, Leben/ Kranken, Bankgeschäft, Asset Management und Corporate eingeteilt.",0.8664405345916748
Transfers between business segments are eliminated in the consolidation.,Die Transfers zwischen den Geschäftssegmenten werden in der Konsolidierung eliminiert.,0.9501684904098511
"Further operations are run in particular in the United States, Central and Eastern Europe and Asia-Pacific.","Weitere Geschäftsaktivitäten werden ins- besondere in den USA, Zentral- und Osteuropa sowie im asiatisch-pazifischen Raum betrieben.",0.8714436292648315
"After the classification of Dresdner Bank as discontinued operation, the banking segment consists of the banking activites in Germany, France, Italy and Central and Eastern Europe.","Nach der Klassifizierung der Dresdner Bank als aufgegebener Geschäftsbereich besteht das Segment Bankgeschäft aus den Bankaktivitäten in Deutschland, Frankreich, Italien sowie Zentral- und Osteuropa.",0.9455229043960571
The Corporate segment also includes the Group’s alternative investment activities.,Das Corporate Segment umfasst zudem die durch den Allianz Konzern getätigten alternativen Investments.,0.8889843225479126
"Further, the timing of sales that would result in such gains or losses is largely at the discretion of the Allianz Group.","Ferner steht es weitgehend im Ermessen des Allianz Konzerns, zu welchem Zeitpunkt solche Gewinne oder Verluste durch Verkäufe realisiert werden.",0.9061724543571472
"Allianz Group Annual Report 2008 Notes to the Consolidated Financial Statements Asset Management Corporate Consolidation Group 2008 2007 2006 2008 2007 2006 2008 2007 2006 2008 2007 2006 €mn €mn €mn €mn €mn €mn €mn €mn €mn €mn €mn €mn 2,887 3,259 3,044 = - _- 115 144 130 92,548 97,681 94,873 60,444 59,362 58,524 98 135 112 883 855 509 (1,147) ~—(1,139) (993) 19,072 18,624 17,430 (77) 31 38 (98) (26) (60) (160) 12 (4) (733) (782) (236) 36 4 (25) 947 3,629 3,108 4,032 4,403 4,186 221 198 190 (469) (455) (498) 6,032 6,553 6,025 28 14 1 1 15 28 (32) (116) (90) 408 217 61 = _ = 2,528 2,367 1,392 aa _— _ 2,549 2,367 1,392 (45,659) (43,122) (42,297) (21) (3) (425) (5,140) (10685) (11,375) (35) (55) (41) (635) (535) (507) 977 905 686 (948) (1,019) (858) = = = = (10) (@) = = = (69) (18) (6) (15) — 1 (6,199) (891) (414) (1) 1 — 1 (115) (215) 216 226 204 (645) (1,037) (1,055) (1,961) (1,900) (1,754) (477) (627) (655) 44 38 50 (17,677) (18,282) _—(17,936) (1,158) (1,270) (1,262) (170) (130) (127) 413 496 528 (2,502) (2,313) (2,040) 1 (16) (140) (12) (17) (13) = — — (2,452) (2,317) (1,381) 5 — — — (2470) (2,317) (1,381) 24 60 429 24 60 429 926 1,359 1,290 (188) (325) (831) (129) (47) (137) 7,433 10,313 9,219 = — — 210 77 (274) (179) (58) 57 47 (35) (134) 5 2 7 245 980 861 102 (191) (11) 2,656 2,379 2,813 (19) (1) (2) (697) (11) 32 (4) _— (1) (3,296) (294) (146) = — — (945) (1,051) (775) = — — (945) (1,051) (775) (278) (491) (532) 33 (15) — = — — (245) (506) (532) @ = 5) @) 7) 61) = (4) (4) (2) (9) = = = = (130) (166) (402) (24) (60) (429) (24) (60) (429) (293) (494) (555) (1,156) (29) (156) (135) (309) (384) (1,960) 250 344 633 865 735 (1,344) (354) (987) (264) (356) (521) 5,473 10,563 9,563 (249) (342) (278) 631 217 824 26 96 451 (1,287) (2,572) (1,720) (5) (25) (53) (12) (21) (16) 3 16 27 (219) (675) (1,203) 379 498 404 (725) (158) (179) (235) (244) (43) 3,967 7,316 6,640 d n a s t n e m e t a t S l a i c n a n i F d e t a d Notes to the Consolidated Financial Statements Allianz Group Annual Report 2008 €mn €mn €mn Gross premiums written?)","Geschäftsbericht Allianz Gruppe 2008 Konzernanhang Asset Management Corporate Konsolidierung Konzern 2008 2007 2006 2008 2007 2006 2008 2007 2006 2008 2007 2006 Mio € Mio € Mio € Mio € Mio € Mio € Mio€ Mio € Mio € Mio € Mio € Mio € 3259 3044 _ _ 144 130 97 681 94 873 _ _ _ _ _ _ 59 362 58524 135 112 855 509 -1139 993 18624 17430 31 38 26 -60 12 -4 -78 -236 _ _ _ _ 4 -25 3629 3108 4403 4186 198 190 455 498 6553 6025 14 1 15 28 -116 -%0 217 61 _ _ 2367 1392 _ _ 2367 1392 _ _ _ _ _ _ 43122 42297 _ _ _ _ -78 425 -1068 -11375 -55 41 535 507 905 686 -1019 -858 _ _ -10 -5 _ _ -18 -5 _ _ _ _ _ 1 891 -414 1 _ -115 -215 226 204 -1037 -1055 -1900 -1754 -627 -655 38 50 -18282 -17936 -1270 -1262 -130 127 496 528 -2313 -2040 _ _ _ _ _ _ -16 -140 _ _ _ _ _ _ -17 -13 _ _ -2317 1381 _ _ -2317 -1381 _ _ _ _ 60 429 60 429 1359 1290 -325 831 -47 -137 10313 9219 _ _ 77 274 58 57 -35 134 2 7 980 861 -191 -11 2379 2813 -1 -2 -11 32 _ -1 294 146 _ _ -1051 -775 _ _ 1051 -775 491 -532 -15 _ _ _ -506 -532 _ -24 _ _ _ _ -17 -51 -4 -9 _ _ _ -166 -402 _ _ _ _ -60 -429 -60 -429 494 555 -29 -156 -309 -384 250 344 865 735 -354 -987 -356 -521 10 563 9563 342 278 217 824 96 451 -2572 -1720 2) Der gesamte Umsatz umfasst die gesamten Bruttobeitragseinnahmen im Schaden-Unfall- sowie im Lebens- und Krankenversicherungsgeschäft (einschließlich der fonds- gebundenen Lebensversicherungen und anderer anlageorientierter Produkte), außerdem die operativen Erträge aus dem Bank- und dem Asset-Management-Geschäft.",0.9101511240005493
"3) For the Asset Management segment, total revenues are measured based upon operating revenues.",3) Im Segment Asset Management wird der gesamte Umsatz an den operativen Erträgen gemessen.,0.9058265686035156
?),!,0.8647227883338928
"As of December 31, 2008, the debt securities include € 55 mn (2007: € 17,281 mn) from public sector issuers and € 492 mn (2007: € 42,434 mn) from other issuers.",Dezember 2008 entfielen von den festverzinslichen Wertpapieren 55 (2007: 17281) Mio € auf öffentliche Emittenten und 492 (2007: 42 434) Mio € auf andere Emittenten.,0.8519241213798523
This effect is characterized by a general market trend and does not allow direct conclusions on the quality of these securities.,Dieser Effekt ist durch einen generellen Markttrend gekenn- zeichnet und erlaubt somit keine direkten Schlussfolgerun- gen auf die Qualität dieser Wertpapiere.,0.8946981430053711
"In 2008, interest rates decreased and thereby induced a positive effect on unrealized losses on govern- ment and government agency bonds by € 469 mn.",Das in 2008 gefallene Zinsniveau führte zu einem positiven Effekt für unrealisierte Verluste bei Staats- und Regierungsanleihen von 469 Mio €.,0.8935853242874146
This effect is characterized by a general market trend and does not allow direct conclusions on the quality of these securities.,Dieser Effekt ist durch einen generellen Markttrend gekenn- zeichnet und erlaubt somit keine direkten Schlussfolgerun- gen auf die Qualität dieser Wertpapiere.,0.8946981430053711
Substantially all of the unrealized losses have been in a continuous loss position for less than 6 months.,"Im Wesentlichen befanden sich alle nichtrealisierten Verluste in einer weniger als sechs Monate dauernden, ununterbrochenen Verlustposition.",0.8556727170944214
In general international corporate business is either underwritten directly or as- sumed by Allianz Global Corporate & Specialty (“AGCS”) from other Allianz Group’s subsidiaries.,Das Industriegeschäft wird grundsätzlich entweder von der Allianz Global Corporate & Specialty AG (AGCS) direkt gezeichnet oder von anderen Allianz Gruppen- gesellschaften an die AGCS zediert.,0.8726010918617249
Allianz SE limits exposures in this portfolio through external reinsurance.,Die Allianz SE begrenzt das Risiko in diesem Portfolio durch externe Rückversicherungen.,0.8568906784057617
"For other risks, the subsidiaries of the Allianz Group maintain individual reinsurance programs.",Für sonstige Risiken halten die Tochterunternehmen des Allianz Konzerns individuelle Rückversicherungsprogramme vor.,0.9245502948760986
"As of January 12, 2009 the sale was completed.",Die Veräußerung wurde im Januar 2009 abgeschlossen.,0.8618556261062622
"2) Includes primarily research and development costs, renewal rights and bancassurance agreements.","2) Enthält im Wesentlichen Forschungs- und Entwicklungskosten, Rechte für Vertragserneuerungen sowie Bancassurance Vereinbarungen.",0.9166236519813538
For the US instead of the Market Consistent Embedded Value the Appraisal Value was derived from a traditional Embedded Value Calculation.,Für die USA wurde der Apprasial Value von einer traditionellen Embedded Value Berechnung abgeleitet.,0.8549128770828247
"Additionally, many of the Allianz Group’s traditional contracts issued in France and Italy do not incor- porate significant insurance risk, although they are account- ed for as insurance contracts, because of their discretionary participation features.","Darüber hinaus bergen zahlreiche traditionelle Verträge im Allianz Konzern, die in Frankreich und Italien vertrieben werden, kein signifikantes versicherungstechnisches Risiko, ungeachtet der Tatsache, dass diese Verträge aufgrund der ermessensabhängigen Überschussbeteiligung als Versiche- rungsverträge bilanziert werden.",0.8789305686950684
"Similarly, a significant portion of the Allianz Group’s unit-linked contracts in France and Italy do not incorporate significant insurance risk.",Ebenso birgt ein Großteil der fondsgebundenen Verträge des Allianz Konzerns in Frankreich und Italien kein signifikantes versicherungs- technisches Risiko.,0.8889111280441284
"As a result of the considerable diversity in types of contracts issued, including the offsetting effects of mortality risk and longevity risk inherent in a combined portfolio of life insur- ance and annuity products, and the geographic diversity of the Allianz Group’s Life/Health segment, as well as the substantial level of policyholder participation in mortality/ morbidity risk in certain countries in Western Europe, the Allianz Group does not believe its Life/Health segment has any significant concentrations of insurance risk, nor does it believe its net income or shareholders’ equity is highly sensitive to insurance risk.","Aufgrund der erheblichen Vielfalt von Vertragsarten, ein- schließlich der sich gegenseitig ausgleichenden Effekte wie Sterberisiko und Langlebigkeitsrisiko in kombinierten Port- folios aus Lebens- und Rentenversicherungen, der geogra- phischen Aufteilung des Geschäftsbereichs Leben/Kranken sowie der Höhe der Beteiligung von Versicherungsnehmern am Sterbe- und Krankheitsrisiko in bestimmten westeuro- päischen Ländern, ist der Allianz Konzern der Überzeugung, dass der Geschäftsbereich Leben/Kranken keine wesent- lichen Versicherungsrisiken birgt und dass der Jahresüber- schuss oder das Eigenkapital keinem besonderen versiche- rungstechnischen Risiko unterliegen.",0.8770028948783875
Contractual obligations do not include contingent liabilities or commitments.,Vertragliche Verpflichtungen umfassen keine Eventualschulden oder Verpflichtungen.,0.9392451047897339
Only transactions with parties outside the Allianz Group are considered.,Es werden nur Transaktionen mit Parteien außerhalb des Allianz Konzerns berücksichtigt.,0.9131006598472595
"Thereof € 1,106 mn the Allianz Group expects to pay within the twelve months after the balance sheet date.","Der Allianz Konzern erwartet, dass davon 1 106 Mio € innerhalb der nächsten zwölf Monate nach dem Bilanzstichtag gezahlt werden.",0.8897053003311157
The income tax obligations are not included in the table below.,Die Ertragsteuerverpflichtungen sind nicht in untenstehender Tabelle enthalten.,0.9384496808052063
4) Purchase obligations only include transactions related to goods and services; purchase obligations for financial instruments are excluded.,4) Kaufverpflichtungen enthalten nur Transaktionen in Bezug auf Güter und Dienstleistungen; Kaufverpflichtungen für Finanzinstrumente sind ausgeschlossen.,0.9435122013092041
"The corresponding amounts, net of reinsurance ceded, are € 14,621 mn, € 12,339 mn, € 6,215 mn and € 14,620 mn for the periods less than 1 year, 1-3 years, 3-5 years and more than 5 years, respectively.","Die entsprechenden Nettobeträge sind jeweils 14.621 Mio €, 12 339 Mio €, 6 215 Mio € und 14.620 Mio € für die Zeiträume weniger als 1 Jahr, 1 bis3 Jahre, 3 bis 5 Jahre und mehr als 5 Jahre.",0.879073441028595
"4,390 _ _ 882 1,482 1,484 8,238 7,658 Banking subsidiaries Senior bonds Fixed rate 564 172 57 23 22 3 841 11,436 Contractual interest rate 3.77% 3.73% 3.75% 3.28% 2.93% 448% = - Floating rate 237 25 30 —_ —_ 145 437 6,675 Current interest rate 4.15% 5.35% 497% = = 2.84% aaa = Subtotal 801 197 87 23 22 148 1,278 18,111 Money market securities Fixed rate 16,289 Contractual interest rate Floating rate 9 Current interest rate Subtotal 16,298 Total banking subsidiaries 801 197 87 23 22 148 1,278 34,409 All other subsidiaries Certificated liabilities Fixed rate 3 3 3 Contractual interest rate 2.11% = - Floating rate _ 25 _ _— _— _— 25 _— Current interest rate = 4.05% Total all other subsidiaries - 25 _ _ _ 3 28 3 Total 5,191 222 87 905 1,504 1,635 9,544 42,070 1) Does not include certificated liabilities of Dresdner Bank which were classified as held for sale.","4390 _ _ 832 1482 1484 8238 7658 Kreditinstitute Anleihen mit fester Verzinsung 564 172 57 23 22 3 841 11436 Zinssatz 3,77% 3,73% 3,75% 3,28% 2,93% 4,48% = _ mit variabler Verzinsung 237 25 30 _ _ 145 437 6675 aktueller Zinssatz 4,15% 5,35% 4,97% _ _ 2,84% _ _ Zwischensumme 801 197 87 23 22 148 1278 18111 Geldmarktpapiere mit fester Verzinsung 16.289 Zinssatz mit variabler Verzinsung 9 aktueller Zinssatz Zwischensumme 16.298 Summe Kreditinstitute 801 197 87 23 22 148 1278 34.409 Sonstige Konzernunternehmen Verbriefte Verbindlichkeiten mit fester Verzinsung 3 3 3 Zinssatz 2,11% _ _ mit variabler Verzinsung _ 25 _ _ _ _ 25 _ aktueller Zinssatz _ 4,05% Summe sonstige Konzernunternehmen —_ 25 —_ —_ _ 3 28 3 Gesamt 5191 222 87 905 1504 1635 9544 42.070 1) Enthalten nicht die Verbrieften Verbindlichkeiten der Dresdner Bank, die zum 31.",0.8574088215827942
"In February 2008 the remaining 2.2 mn warrants were exercised which the Allianz Group had issued in February 2005 as part of the , All-in-One” transaction.","Im Februar 2008 wurden die letzten 2,2 Millionen Options- scheine ausgeübt, die der Allianz Konzern im Februar 2005 im Rahmen der „All-in-One“-Transaktion begeben hatte.",0.8542642593383789
"In conjunction with the exercise, 2.2 mn new shares of Allianz SE resulting from conditional capital were issued leading to proceeds from this increased equity of € 202 mn.","Im Zusammenhang mit der Ausübung wurden entsprechend 2,2 Millionen neue Aktien aus bedingtem Kapital emittiert, woraus der Allianz SE ein Emissionserlös in Höhe von 202 Mio € zufloss.",0.8753336071968079
The new shares are entitled to dividend as of the financial year 2008.,Die neuen Aktien sind ab dem Geschäfts- jahr 2008 dividendenberechtigt.,0.9008802771568298
"As a result, issued capital increased by € 2 mn and capital reserve increased by € 43 mn.",Dies führte zu einer Erhöhung des gezeichneten Kapitals um 2 Mio € und der Kapitalrücklagen um 43 Mio €.,0.860730767250061
"In April 2007, 16,974,357 new Allianz SE shares were issued for the execution of the minority buy-out of AGF shares.","Im April 2007 wurden für die Übernahme der Anteile der Minderheitsaktionäre an der AGF neue Aktien der Allianz SE ausgegeben, die zu einer Erhöhung der Aktienstückzahl um 16 974 357 führte.",0.8831757307052612
"On October 13, 2006, Allianz AG and RAS merged resulting in the issuance of 25,123,259 shares of Allianz SE to the shareholders of RAS.",Oktober 2006 wurden aufgrund der Fusion der Allianz AG und der RAS 25 123 259 Aktien der Allianz SE an die Aktionäre der RAS ausgegeben.,0.9261794090270996
"On January 1, 2005, the Financial Conglomerates Directive, a supplementary European Union (“EU”) directive, became effective in Germany.","Januar 2005 wurde in Deutschland die Finanzkonglomeraterichtlinie, eine ergänzende EU-Richt- linie, wirksam.",0.8877227902412415
The Allianz Group is a financial conglomerate within the scope of the directive and the related German law.,Beim Allianz Konzern handelt es sich nach dieser Richtlinie und den betreffenden deutschen Gesetzen um ein Finanzkonglomerat.,0.8840773701667786
The minimum capital requirements and dividend restrictions vary by jurisdiction.,Die An- forderungen an das Mindestkapital und die Beschränkungen der Dividenden variieren in Abhängigkeit von den gesetzli- chen Vorschriften.,0.8615912199020386
Dividends paid in excess of these limitations generally require prior approval of the insurance commissioner of the state of domicile.,"Dividenden, die über diese Beschränkungen hinaus ausge- zahlt werden, benötigen im Allgemeinen die vorherige Zustimmung des Versicherungsbeauftragten des Heimat- staates.",0.8893542885780334
The Allianz Group believes that these restrictions will not affect the ability of Allianz SE to pay dividends to its shareholders in the future.,"Der Vorstand des Allianz Konzerns nimmt an, dass diese Beschränkungen die Fähigkeit des Allianz Konzerns, künftig Dividenden an seine Aktionäre auszuschütten, nicht beeinflusst.",0.8694330453872681
