english,german,similarity
"Issues that matured in 2008 5.0% bond issued by Allianz Finance B.V., Amsterdam Volume €1.6 bn Year of issue 1998 Maturity date 3/25/2008 ISIN DE 000 230 600 8 Interest expense €19.9 mn 0.75 % Basket Index Tracking Equity Linked Securities (BITES) issued by Allianz Finance Il B.V., Amsterdam Underlying DAX® Volume €0.5 bn Year of issue 2005 Maturity date 2/18/2008 ISIN XS.021 157 635 9 Interest expense €0.3mn Total interest expense for matured issues relevant bonds provide for alternative settlement mechanisms which allow us to avoid an interest deferral using cash raised from the issuance of specific newly issued instru- ments.","Ausgabejahr 1998 Fällig 25.3.2008 6,5%-Anleihe der Allianz Finance II B. V., Amsterdam ISIN DE 000 230 6008 _ Volumen TOMrde Zinsaufwand 19,9Mio€ Ausgabejahr 2002 Fällig 13.1.2025 0,75% Basket Index Tracking Equity Linked Securi- ISIN %5015 952 750 5 ties (BITES) indexgebundene Wandelanleihen der Allianz Finance Il B.V., Amsterdam Zinsaufwand 660MIOE Basiswert DAX® Volumen 0,5Mrd€ 7,25%-Anleihe der Allianz Finance II B. V., Ausgabejahr 2005 Amsterdam Fallig 18.2.2008 Yolumen 05 Mrd USD ISIN 5021 1576359 Ausgabejahr 2002 m Zinsaufwand 0,3 Mio€ Fällig Perpetual Bond - — = ISIN x5 0159150720 Summe Zinsaufwand ausgelaufene Emissionen 20,2 Mio € XS 015 915 072 0 1) Für nicht nachrangige Schuldverschreibungen und Commercial Paper Emissionen beste- hen vorzeitige Kündigungsrechte im Falle der Nicht-Zahlung von Zins und Hauptforde- rung sowie im Fall der Insolvenz.",0.8640871047973633
.,.,0.9999997019767761
.,.,0.9999997019767761
Net cash outflow provided by financing activities increased by €0.5 billion to € 11.3 billion in 2008.,"Die Nettoabflüsse aus der Finanzierungstätigkeit nahmen 2008 um 0,5 Milliarden Euro auf 11,3 Milliarden Euro zu.",0.8943223357200623
.,.,0.9999997019767761
.,.,0.9999997019767761
.,.,0.9999997019767761
.,.,0.9999995231628418
"As of December 31, 2008, compulsory deposits on accounts with national central banks under restrictions due to re- quired reserves from the European Central Bank totaled € 363 million (2007: € 5,473 million)”.","Dezember 2008 beliefen sich die gesetzlich vor- geschriebenen Guthaben bei den nationalen Zentralnoten- banken, die aufgrund der Rücklagenvorschriften der Euro- päischen Zentralbank Beschränkungen unterliegen, auf 363 (5 473) Millionen Euro.",0.8666092157363892
The Supervisory Board Risk Committee of Allianz SE meets on a regular and ad-hoc basis to monitor the risk profile of the Allianz Group based on risk reports presented by the Chief Financial Officer and Chairman of the Group Risk Committee.,"Das Risikokomitee des Aufsichtsrats der Allianz SE tritt regelmäßig und auch spontan zusammen, um das Risikoprofil der Allianz Gruppe anhand von Risiko- berichten zu überwachen, die der Chief Financial Officer und Chairman des Group Risk Committee vorlegt.",0.9036610126495361
It also defines risk standards and establishes risk limits.,Ferner legt es die Risikostandards und Risikogrenzen fest.,0.8645495772361755
"Furthermore, it is re- sponsible for recommending and coordinating measures to mitigate risk.",Außerdem empfiehlt und koordiniert es Maßnahmen zur Risikominderung.,0.9190173745155334
"The Group Risk department (“Group Risk”), which reports to the Chief Financial Officer, develops methods and processes for identifying, assessing and monitoring risks across the Allianz Group based on systematic qualitative and quanti- tative analysis and regularly informs management concern- ing the Allianz Group’s risk profile.","Die Abteilung Group Risk, die an den Chief Financial Officer berichtet, entwickelt Methoden und Prozesse, die geeignet sind, Risiken gruppenweit zu identifizieren, zu bewerten und zu überwachen, und zwar auf der Grundlage einer systematischen qualitativen und quantitativen Analyse.",0.8953074216842651
"The risk governance structure is further complemented by Group Audit, Group Compliance and Group Legal Services.","Unsere Risk-Governance-Struktur wird überdies durch die Abteilungen Group Audit, Group Compliance und Group Legal Services ergänzt.",0.9049138426780701
"Where possible, we develop correlation parameters for each pair of risks through statistical analysis of historical data.","Wo immer möglich, entwickeln wir Korrelationsparameter für jedes Risikopaar, indem wir historische Daten statistisch analysieren.",0.8898263573646545
"2) As commodity risk is not significant on the Group level, it is covered in our internal risk capital model within currency risk.","2) Da das Rohwarenrisiko auf Gruppenebene unerheblich ist, wird es vom internen Risikokapitalmodell im Währungsrisiko erfasst.",0.917894184589386
"3) Although the internal risk capital requirements for the Asset Management segment only reflect business risk (please see below for further information), the evaluation of market risk and credit risk on the account of third parties is an integral part of the risk management process of our local operating entities.","3) Obgleich die Anforderungen bezüglich des internen Risikokapitals an das Segment Asset Management nur das Geschäftsrisiko widerspiegeln, ist die Bewertung des Markt- und Kreditrisikos bei Kapitalanlagen für Dritte ein wesentlicher Bestandteil des Risikomanagementprozesses unserer lokalen operativen Einheiten.",0.87895667552948
"4) The premium risk which our credit insurance entity Euler Hermes is exposed to due to its business model is also covered here, as this type of risk is a special form of credit risk.","4) Das Rückversicherungsrisiko erfasst auch das Prämienrisiko, dem unser Kreditversicherer Euler Hermes aufgrund seines Geschäftsmodells ausgesetzt ist, weil diese Art von Risiko eine spezielle Form von Kreditrisiko darstellt.",0.9387003183364868
"Furthermore, credit risks include country (and transfer) risk.",Ferner umfassen die Kreditrisiken Länder- und Transferrisiken.,0.8866996765136719
"This currency risk is monitored and managed centrally at the Allianz Group level by Group Corporate Finance & Treasury and is, therefore, mostly allocated to the Corporate segment.",Dieses Fremdwährungsrisiko wird von der Abtei- lung Group Corporate Finance & Treasury zentral gesteuert und ist daher überwiegend dem Segment Corporate zuge- ordnet.,0.9044250249862671
"Overall, we believe that our model adequately assesses the risks to which we are exposed.","Ins- gesamt meinen wir, dass unser Modell unsere Risiken ange- messen bewertet.",0.8654041886329651
"Our aim is to ensure that the Allianz Group is adequately capi- talized at all times, even following a significant adverse event, and that all operating entities meet their respective capital requirements.","Wir wollen sicherstellen, dass die Allianz Gruppe jederzeit angemessen kapitalisiert ist, selbst nach einem maßgeblichen nachteiligen Ereignis, und dass alle unsere operativen Einheiten ihre jeweiligen Kapitalanforderungen erfüllen.",0.866629958152771
"In addition, we employ a value-based approach (Economic Value Added or “EVA”®), among other approaches, to measure and manage our business activities as well as to optimize capital allocation across the Allianz Group.","Ferner verwenden wir unter anderem einen wert- orientierten Ansatz (Economic Value Added, kurz EVA®) zur Messung und zur Steuerung unserer Geschäftstätigkeiten sowie zur Verbesserung unserer Kapitalzuteilung in der gesamten Allianz Gruppe.",0.8635581135749817
Internal risk capital is a key parameter of our EVA®- approach.,Das interne Risikokapital ist einer der wichtigsten Parameter unseres EVA®-Ansatzes.,0.9591581225395203
"In managing our capital position, we also consider additional external requirements of regulators and rating agencies.",Außerdem berücksichtigen wir bei der Steuerung unserer Kapitalposition zusätzliche externe Anforderungen von Aufsichtsbehörden und Rating-Agenturen.,0.8883638978004456
Our objective is to maintain available capital at the Group level in excess of the minimum requirements that are determined by our internal risk capital model according to a solvency probability of 99.97 % over a holding period of one year.,"Unser Ziel ist es, die Kapitalausstattung der Gruppe zu ge - währleisten, und zwar über die Mindestanforderungen hinaus, die unser internes Risikokapitalmodell mit einer Solvenzwahrscheinlichkeit von 99,97 Prozent während einer Haltedauer von einem Jahr vorgibt.",0.890646755695343
"Non-diversified and Group diversi- fied internal risk capital are broken down as follows: Allocated internal risk capital by risk category (total portfolio before minority interest) in€mn 80,000 74,291 72,124 : 60,000 40,000 33368 30872 7,233 20,000 0 12/31/2007—_-12/31/2008 12/31/2007 12/31/2008 Internal risk capital 2007: including discontinued operations 2008: excluding discontinued operations.",Das nichtdiversifizierte und das gruppenweit diversifizierte interne Risikokapital unterteilten sich wie folgt: Zugeordnetes internes Risikokapital nach Risikoquelle (Gesamtbestand vor Abzug der Beteiligung der Minder- heitsaktionäre) 80.000 74291 72124 18365 738 15013 60000 40.000 3368 y8n 7233 20.000 0 31.122007?,0.8648632168769836
The Allianz Group is a financial conglomerate within the scope of the Directive and related German law.,Beim Allianz Konzern handelt es sich nach dieser Richtlinie und den betreffenden deutschen Gesetzen um ein Finanzkonglomerat.,0.8776469230651855
"At December 31, 2008, the financial strength of Allianz SE was rated by Standard & Poor’s as “AA” (stable outlook), by A. M. Best as “A+” (stable outlook), and by Moody’s as “Aa3” (stable outlook).","Zum Jahresende 2008 wurde die finanzielle Stärke der Allianz Gruppe von Standard & Poor’s mit „AA“ (Ausblick stabil), von A.M. Best mit „A+“ (Ausblick stabil) und von Moody’s mit „Aa3“ (Ausblick stabil) eingestuft.",0.8769603371620178
"As of December 31, 2007, reported under the old method, the solvency ratio was 157% and available funds were € 45.5 billion.","Dezember 2007 beliefen sich gemäß alter Methode die Solvabilitätsquote auf 157 Prozent und die verfügbaren Eigenmittel auf 45,5 Milliarden Euro.",0.856593906879425
"As we are an integrated financial service provider offering a variety of products across different business segments and geographic regions, diversification is key to our business model.","Als integrierter Finanzdienstleistungsanbieter mit einer breiten Produktpalette, die sich über verschiedene Ge- schäftssegmente und geographische Regionen erstreckt, ist die Diversifikation für unser Geschäftsmodell ausschlagge- bend.",0.9100027084350586
"In general, we identify and measure risk concentrations in terms of non-diversified internal risk capital in line with the risk categories covered in our internal risk capital model.",Im Allgemeinen bestimmen und messen wir die Risikokon- zentration auf der Basis des nichtdiversifizierten internen Risikokapitals entsprechend den Risikokategorien unseres internen Risikokapitalmodells.,0.9056273102760315
In the subsequent sections all risks are presented before and after diversification and concentrations of single sources of risk are discussed accordingly.,In den folgenden Abschnitten werden alle Risiken vor und nach Diversifikation vor- gestellt und die Konzentration der einzelnen Risikoquellen besprochen.,0.9226304888725281
3) Foreign currency risks are mainly allocated to the Corporate segment (please refer to “Internal Risk Capital Framework – Scope” for further information).,3) Fremdwährungsrisiken werden in erster Linie dem Segment Corporate zugeordnet (für weitere Informationen siehe auch „Internes Risikokapitalrahmenwerk – Umfang“).,0.9297031164169312
4) The internal risk capital requirements for the Asset Management segment only reflect business risk (please refer to “Internal Risk Capital Framework – Scope” for further information).,4) Der interne Risikokapitalbedarf des Segments Asset Management spiegelt lediglich das Geschäftsrisiko wider (für weitere Informationen siehe „Internes Risikokapitalrahmen- werk – Umfang“).,0.956812858581543
"In this segment, internal risk capital additionally increased significantly due to the model change for which more de- tails are provided in the following section.","In diesem Seg- ment stieg das interne Risikokapital außerdem stark auf- grund einer Modelländerung an, zu der im nachstehenden Abschnitt nähere Angaben gemacht werden.",0.8815464973449707
"The table below presents the average internal risk capital for market risk calculated over the four quarters of 2008 and 2007, as well as the high and low quarterly internal risk capital amounts calculated in both years.",Die folgende Tabelle zeigt das durchschnitt- liche interne Risikokapital für Marktrisiken sowie die Höchst und Niedrigstbeträge für 2008 und 2007.,0.8556796312332153
"Grouped according to our internal risk capital model categories, the following are the most significant market risks in terms of market values: equity price risk (including risks arising from com- mon shares and preferred shares) and interest rate risk (arising from bonds, loans and mortgages).","Im Folgenden werden die (nach Marktwert) höchsten Marktrisiken aufgezählt, kategorisiert wie in unserem inter- nen Risikokapitalmodell: Aktienkursrisiko (einschließlich der Risiken aus Stammaktien und Vorzugsaktien) und Zins- risiko (aus Anleihen, Darlehen und Hypotheken).",0.8884654641151428
"Although the internal risk capital requirements for the Asset Management segment only reflect business risk, the evaluation of market risk and credit risk on the account of third parties is an integral part of the risk management process of our local operating entities.","Obwohl der interne Risikokapitalbedarf für das Asset Ma- nagement lediglich das Geschäftsrisiko widerspiegelt, ist die Bewertung des Markt- und Kreditrisikos für Kapitalan- lagen Dritter ein fester Bestandteil des Risikomanagement- prozesses unserer lokalen Gesellschaften.",0.9151855111122131
"Our Asset Manage- ment operating entities monitor market risks using VaR models, sensitivity analyses and stress tests that estimate the potential loss under extreme market conditions.","Unsere Asset- Management-Gesellschaften überwachen die Marktrisiken anhand von VaR-Modellen, Sensitivitätsanalysen und Stress- tests, mit denen der potenzielle Verlust unter extremen Marktbedingungen geschätzt wird.",0.9238157272338867
All underlying models are regularly reviewed by the risk depart- ments of the respective local operating entities.,Alle zugrunde liegenden Modelle werden regelmäßig von den Risikoabteilungen der jeweiligen lokalen Gesellschaften überprüft.,0.8698899745941162
"The primary Corporate risks are interest rate, equity and for- eign currency risks.","Die primären Unternehmensrisiken sind das Zins-, das Aktien- und das Fremdwährungsrisiko.",0.8862628936767578
"The Corporate segment manages the equity investments of Allianz SE and its finance subsidiary holding companies, as well as securities issued to fund the capital requirements of the Allianz Group.",Das Segment Corpo- rate steuert die Aktienanlagen der Allianz SE und ihrer Finanzholdinggesellschaften sowie die emittierten Wert- papiere zur Finanzierung des Kapitalbedarfs der Allianz Gruppe.,0.864974856376648
The loss profile is the basis of our internal credit risk capital model.,Das Verlust- profil ist die Grundlage unseres internen Kreditrisikokapital- modells.,0.93354332447052
Our internal credit risk capital increased in 2008 mainly due to rating downgrades of some of our counterparties follow- ing the financial turmoil throughout 2008.,"Unser internes Kreditrisikokapital stieg 2008, was in erster Linie auf Bonitätsherabstufungen bei einigen unserer Kon- trahenten im Zuge der Finanzkrise 2008 zurückzuführen ist.",0.8867104649543762
"Average, high and low allocated internal credit risk capital by source of risk (total portfolio before minority interests, after Group diversification and including discontinued operations) 2008 2007 Over quarterly results Over quarterly results Average High Low Average High Low €mn €mn €mn €mn €mn €mn Total Group 6,127 6,614 5,837 5,385 5,701 5,247 Investment 4358 4771 4,181 3,966 4128 3,862 (Re)insurance 1,770 1,871 1,656 1,419 1,573 1,356 2008 figures exclude discontinued operations.","Durchschnittliches zugeordnetes internes Kreditrisikokapital nach Risikoquelle (Gesamtbestand vor Abzug der Beteiligungen der Minderheitsaktionäre, nach Gruppendiversifikation und einschließlich aufgegebener Geschäftsbereiche) 2008 2007 Über Quartalswerte Über Quartalswerte Durch- Hoch Niedrig Durch- Hoch Niedrig schnitt schnitt Mio€ Mio€ Mio€ Mio€ Mio€ Mio€ Gruppe insgesamt 6127 6614 5837 5385 5701 5247 Anlage 4358 4771 4181 3 966 4128 3862 (Rück-)Versicherung® 1770 1871 1656 1419 1573 1356 1) In den Zahlen für 2008 sind aufgegebene Geschäftsbereiche nicht enthalten.",0.8545218706130981
"3) The premium risk which our credit insurance entity Euler Hermes is exposed to due to its business model is also covered here, as this type of risk is a special form of credit risk.","3) Das Rückversicherungsrisiko erfasst auch das Prämienrisiko, dem unser Kreditversicherer Euler Hermes aufgrund seines Geschäftsmodells ausgesetzt ist, weil diese Art von Risiko eine spezielle Form von Kreditrisiko darstellt.",0.9370708465576172
4) The internal risk capital requirements for the Asset Management segment only reflect business risk (please refer to “Internal Risk Capital Framework – Scope” for further information).,4) Der interne Risikokapitalbedarf des Segments Asset Management spiegelt lediglich das Geschäftsrisiko wider (für weitere Informationen siehe „Internes Risikokapitalrahmen- werk – Umfang“).,0.956812858581543
"Credit risk – reinsurance and credit insurance Credit risk – reinsurance and credit insurance This risk category also covers the premium risk which our credit insurance entity Euler Hermes is exposed to due to its business model, as this type of risk is a special form of credit risk.","Kreditrisiko Rückversicherung und Kreditversicherung Das Rückversicherungsrisiko erfasst auch das Prämienrisiko unseres Kreditversicherers Euler Hermes, das aus dessen Geschäftsmodell erwächst und eine Spezialform von Kredit- risiko darstellt.",0.8871480226516724
"As of December 31, 2008, it represented 64 % of our total Group non-diversified internal risk capital allocated to credit reinsurance risk.",Dezember 2008 umfasste es rund 64 Prozent des gesamten nichtdiversifizierten internen Risi- kokapitals für Kreditrisiken im Rückversicherungsgeschäft.,0.8575841188430786
The Asset Management operating entities analyze the credit worthiness of their counterparties and set limits per counter- party based on objective criteria.,Die operativen Einheiten im Asset Management bewerten die Kreditwürdigkeit ihrer Kontrahenten und legen für jeden einzelnen nach objektiven Kriterien Limits fest.,0.8562131524085999
"Although our discontinued operations are not exposed to actuarial risks, they have an impact on Group diversified internal risk capital due to diversification effects.","Obwohl unsere aufge- gebenen Geschäftsbereiche keinen versicherungstechnischen Risiken ausgesetzt sind, wirken sie sich aufgrund von Diversifikationseffekten auf das diversifizierte interne Risi- kokapital der Gruppe aus.",0.8625723719596863
Business risks consist of operational risks and cost risks.,Geschäftsrisiken setzen sich aus operationalen Risiken und Kostenrisiken zusammen.,0.9092805981636047
"Operational risks include legal risk, whereas strategic risk and reputational risks are excluded in accordance with the requirements of Solvency II and Basel II.","Während in den operationalen Risiken rechtliche Risiken enthalten sind, werden die strategischen und die Reputationsrisiken im Einklang mit den Anforderungen von Solvency II und Basel II ausgeschlossen.",0.9270086884498596
They also include the risk of budget deficits resulting from lower revenues or higher costs than budgeted.,"In die Kostenrisiken ist auch das Risiko eines Budgetdefizits eingeschlossen, das aus geringeren Einnahmen oder höheren Kosten herrührt, als dies im Budget vorgesehen ist.",0.9104511141777039
3) The internal risk capital requirements for the Asset Management segment only reflect business risk (please see “Internal Risk Capital Framework – Scope” for further information).,3) Der interne Risikokapitalbedarf des Segments Asset Management spiegelt lediglich das Geschäftsrisiko wider (für weitere Informationen siehe „Internes Risikokapitalrahmen- werk – Umfang“).,0.9600926041603088
Internal risk capital for guarantees in the Asset Management segment are not significant.,Internes Risikokapital für Garantien im Segment Asset Management ist ohne Bedeutung.,0.9538798928260803
"For these risks, we also pursue a systematic approach with respect to identification, analysis, assessment and monitoring.","Um diese Risiken zu identifi- zieren, zu analysieren, zu bewerten und zu überwachen, verfolgen wir einen systematischen Risikobewertungsan- satz.",0.8677114248275757
"The most important of these other risks include liquidity, reputational and strategic risk.","Zu den wichtigsten dieser sonstigen Risiken zählen das Liquiditäts-, das Reputations- und das strategische Risiko.",0.9151128530502319
"However, these effects are covered by our internal risk capital model.",Diese Auswirkungen werden jedoch von unserem internen Risikokapitalmodell abgedeckt.,0.9695572853088379
"In the Asset Management segment, we limit liquidity risk by continually reconciling the cash flows from our operating business with our commitments to pay liabilities.","Im Asset Management begrenzen wir das Liquiditätsrisiko, indem wir Zahlungsströme aus unserem Geschäftsbetrieb mit der Verpflichtung, unsere Verbindlichkeiten zu erfüllen, ständig abgleichen.",0.8981364369392395
"On the basis of this evaluation, Group Risk creates an overview of local and global risks which also includes reputational risks, analyses the risk profile of the Allianz Group and regularly informs management about the current situation.","Auf dieser Grundlage erstellt Group Risk einen Überblick über die lokalen und globalen Risiken einschließlich der Reputationsrisiken, analysiert das Risikoprofil der Allianz Gruppe und informiert die Geschäftsleitung regelmäßig über den aktuellen Stand.",0.9139574766159058
"Strategic risk is the risk of an unexpected negative change in the company value, arising from the adverse effect of management decisions on both business strategies and their implementation.","Das strategische Risiko ist das Risiko einer unerwarteten nachteiligen Veränderung des Unternehmenswerts, die dadurch entsteht, dass geschäftsstrategische Entscheidun- gen des Managements oder deren Ausführung negative Folgen haben.",0.8880124092102051
"Strategic risk also includes the ability of management to effectively ana- lyze and react to external factors, which could impact the future direction of the relevant operating entity.","Dem strategischen Risiko zugehörig ist auch die Fähigkeit des Managements, externe Faktoren, welche die künftige Ausrichtung einer bestimmten operativen Einheit beeinflussen könnten, zu erkennen und darauf angemessen einzuwirken.",0.8527646660804749
We are continuously providing feedback on the proposals and analyses of the Committee of European Insurance and Occupational Pensions Supervisors (CEIOPS) and the EU Commission.,Wir geben laufend unsere Rückmeldungen zu den Vorschlägen und Analysen des Committee of European Insurance and Occupational Pensions Supervisors (CEIOPS) und der EU-Kommission.,0.933151125907898
"Furthermore, we participate in the Quantitative Impact Studies and give technical advice, for instance, through the Chief Risk Officer Forum, which is comprised of the Chief Risk Officers of the major European insurance companies and financial conglomerates.","Des Weiteren nehmen wir an den Quantitative Impact Studies teil und vermitteln technische Hilfe, zum Beispiel über das Chief Risk Officer Forum, das sich aus den Chief Risk Officers der größten europäischen Versicherungsgesellschaften und Finanzkonglomerate zusammensetzt.",0.9482613205909729
It is our aim to have our inter- nal risk capital model and our risk management practices comply with the forthcoming internal model supervisory requirements at an early stage.,"Unser Ziel ist es, das interne Risikokapital- modell und unsere Risikomanagementpraktiken frühzeitig an die zu erwartenden aufsichtsrechtlichen Anforderungen hinsichtlich interner Modelle anzupassen.",0.8901024460792542
"As part of the Solvency II umbrella project, a subproject has been launched to roll-out a new operational risk manage- ment platform to all operating entities which will automate the operational risk management process, complemented by a refined risk and control self-assessment based on scenarios.","Als Teil unseres Solvency-II-Projekts wurde damit begonnen, eine neue Plattform zum Management operationaler Risi- ken für alle Gesellschaften einzuführen, die den Prozess automatisieren wird.",0.8520187139511108
1) Source: As published by Gesamtverband der deutschen Versicherungswirtschaft e.V.,1) Quelle: Veröffentlichung des Gesamtverbandes der deutschen Versicherungswirtschaft e.V.,0.9705929160118103
(GDV) in 2008.,(GDV) 2008.,0.9677326679229736
The GDV is a private association representing the German insurance industry.,"Der GDV ist ein privater Verband, der die deutsche Versicherungs- branche repräsentiert.",0.8903175592422485
