english,german,similarity
"The concepts contained in this report are in line with the content of our 2019 Group Sustainability Report, which is compiled in accord- ance with the standards set out by the Global Reporting Initiative (GRI) and will be published in April 2020.","Die in diesem Bericht enthaltenen Konzepte entsprechen dem In- halt des konzernweiten Nachhaltigkeitsberichts 2019, der nach den Global Reporting Initiative (GRI)-Standards erstellt und im April 2020 veröffentlicht wird.",0.9420968294143677
"Corporate Responsibility Governance and Strategy At Allianz, we aim to create sustainable economic value by pursuing a long-term approach to corporate governance, social responsibility, and environmental stewardship.","Corporate Responsibility Governance und Strategie Als Allianz wollen wir durch eine gute Unternehmensführung, soziale Verantwortung und ökologische Selbstverpflichtung nachhaltigen wirtschaftlichen Wert schaffen.",0.8578232526779175
The 2019 non-financial reporting section covers the entire Allianz Group and also includes the relevant non-financial information for Allianz SE.,Der Nichtfinanzielle Bericht 2019 bezieht den gesamten Allianz Konzern mit ein und enthält zudem die relevanten nichtfinan- ziellen Informationen für die Allianz SE.,0.9385088682174683
"Unless otherwise stated, we use the control principle defined by the International Financial Report- ing Standards when determining the scope of our reporting on behalf of our consolidated entities.","Falls nicht anders angegeben, bedienen wir uns bei der Festlegung des Berichtsumfangs für unsere vollkonsolidierten Gesellschaften des Kontrollgrundsatzes gemäß der Definition in den International Financial Reporting Standards.",0.8774427771568298
The Group Underwriting Committee monitors the underwriting business and related risk management.,Der Underwriting-Ausschuss des Konzerns überwacht das Under- writing und das zugehörige Risikomanagement.,0.9069902896881104
"Any potential risks and impacts identified throughout our risk assessment have been addressed by the respective concepts we have in place, which we describe in this report.","Alle potenziellen Risiken und Aus- wirkungen, die wir mittels Risikoanalysen identifiziert haben, adressie- ren wir durch jeweilige in diesem Bericht beschriebene Konzepte.",0.8735549449920654
"As a global insurer, investor and asset manager, understanding ESG issues allows Allianz to reduce risks and capture opportunities in underwriting, claims, investment management, and asset manage- ment.","Als globales Versicherungsunternehmen, Investor und Vermö- gensverwalter berücksichtigt Allianz ESG-Themen, um die Risiken und Chancen in den Bereichen Underwriting, Schadenaufwendungen, In- vestment Management und Asset Management zu reduzieren und zu nutzen.",0.8631768822669983
"Since December 2016, the ESG Scoring has provided Allianz investment and asset man- agers with ESG performance information to be included in invest- ment decisions.","Seit Dezember 2016 liefert das ESG-Scoring den Investment-Managern und Ver- mögensverwaltern der Allianz ESG Performance-Informationen, die in unsere Anlageentscheidungen einfließen.",0.9102592468261719
"Data related to our ESG integration approach will be included in our Group Sustainability Report 2019, to be published in April 2020.","Daten, die im Zusammenhang mit unserem Integrationsansatz von ESG-Kriterien stehen, werden in den Konzernnachhaltigkeitsbericht 2019 aufgenommen, der im April 2020 veröffentlicht wird.",0.9050356149673462
An in-depth overview of our approach and processes to integrating ESG is published in the Allianz ESG Integration Framework at www.allianz.com/esg-framework.,Eine detail- lierte Beschreibung unseres Ansatzes und unserer Prozesse zur In- tegration von ESG-Kriterien entnehmen Sie dem Allianz ESG Integra- tion Framework auf www.allianz.com/de/esg-framework.,0.8577352166175842
"This section describes the impact of environmental matters on our business activities and relationships, as well as the impact of Allianz’s activities and relationships on the environment.",Dieser Abschnitt beschreibt die Auswirkungen von Umweltbelangen auf unsere Geschäftstätigkeit und unsere Geschäftsbeziehungen so- wie die Auswirkungen der Geschäftstätigkeit und -beziehungen der Allianz auf die Umwelt.,0.9425524473190308
"1_Cluster munitions, anti-personnel landmines, chemical and biological weapons.","1_Streumunition, Antipersonenminen, chemische und biologische Waffen.",0.879815399646759
"Specifically, we are committed to the long-term target of reducing the carbon emis- sions from our proprietary investments to net-zero by 2050.","Konkret haben wir uns dem langfristigen Ziel ver- pflichtet, die CO2 -Emissionen unseres Anlageportfolios bis 2050 auf „Netto-Null“ zu reduzieren.",0.8541562557220459
"Furthermore, we enter into active dialog with compa- nies, encouraging them to define and implement their own climate strategies in line with the latest scientific findings.","Zudem suchen wir mit Unternehmen einen aktiven Dialog, um sie zu ermutigen, ihre eigenen Klimastrategien entsprechend den jüngsten wissenschaftlichen Er- kenntnissen nach zu definieren und umzusetzen.",0.87681645154953
"We care for our customers and advise them on how to reduce risks and minimize damage, while compensating those who have suffered losses.","Wir kümmern uns um unsere Kunden und beraten sie, wie sie Risi- ken reduzieren und Schäden minimieren können, während wir diejeni- gen entschädigen, die Verluste erlitten haben.",0.8620097637176514
"We enable positive change as an insurer, developing and offering insurance solutions for renewables technologies and energy efficiency.","Als Versicherer ermöglichen wir eine Veränderung zum Positiven, indem wir Versicherungslösungen für erneuerbare Technologien und Energieeffizienz entwickeln und anbieten.",0.9134276509284973
Allianz also offers a variety of funds for institutional investors seeking to invest in low-carbon assets such as renewable energy or green bonds.,"Die Allianz bietet außerdem eine Reihe von Fonds für institutionelle Investoren an, die in kohlenstoffarme Anlagen wie erneuerbare Energien oder grüne Anleihen investieren möchten.",0.8774990439414978
"For further information on renewable energy investments, please refer to note 6 to our Consolidated Financial Statements.",Weitere Informationen zu unseren Investitionen in erneuerbare Ener- gien finden sich unter Angabe 6 im Anhang zum Konzernabschluss.,0.861237645149231
"Furthermore, we actively support the expansion of companies’ climate-related disclosures.",Zusätzlich unterstützen wir aktiv eine Erweiterung der klima- bezogenen Berichterstattung von Unternehmen.,0.8724374175071716
We report on climate-related opportuni- ties and risks based on the framework developed by the G20’s Task Force on Climate related Financial Disclosures (TCFD).,Wir berichten selbst über klimarelevante Chancen und Risiken auf der Grundlage des von der G20 Task Force on Climate-related Financial Disclosures (TCFD) entwickelten Rahmenwerks.,0.9246636033058167
"2_Utilities generating 30 % or more of their electricity from thermal coal and/or planning more than 0.5 gigawatts of coal capacity additions, and/or having to retire more than 50 % of their generation capacities in the next ten years to be in line with the 2°C ceiling, as well as mining companies generating 30 % or more of their revenue from thermal coal.","2_Stromerzeugende Unternehmen, die 30 % oder mehr des von ihnen erzeugten Stroms auf Kohlebasis generieren und/oder Kohlekapazitätserweiterungen von mehr als 0,5 Gigawatt planen und/oder mehr als 50 % ihrer Erzeugungskapazität in- nerhalb der nächsten zehn Jahre stilllegen müssen, um die 2°C-Obergrenze einzuhalten, sowie Bergbauunternehmen, die 30 % oder mehr ihres Umsatzes mit Kraftwerkskohle erzielen.",0.8574075698852539
"We actively contributed to setting up the UN-convened Net- Zero Asset Owner Alliance, a group of asset owners committed to reduce the carbon emissions of their investment portfolios to net-zero by 2050.","Wir haben aktiv am Aufbau der UN-convened Net-Zero Asset Owner Alliance mitgewirkt – eine Gruppe von Asset Ownern, die sich dazu verpflichten, die CO2 -Emissionen ihrer Anlage- portfolios bis 2050 auf Netto-Null zu reduzieren.",0.9275408387184143
"Operational implementation is monitored by the Group Environmental Officer, and supported by the Board of Management of Allianz SE.",Die operationelle Umsetzung liegt beim Group Environmental Officer und wird vom Vorstand der Allianz SE unterstützt.,0.8967207074165344
We are well on track to achieve our 2020 targets.,"Wir sind auf einem guten Weg, unsere Ziele für das Jahr 2020 zu erreichen.",0.8962289690971375
"Target: Reduce carbon emissions by 30 % per employee by 2020, against a 2010 baseline1.",Ziel: Die CO2 -Emissionen pro Mitarbeiter wollen wir bis 2020 um 30 % gegenüber dem Referenzjahr 20101 reduzieren.,0.8914013504981995
"GHG emissions per employee, Allianz SE2 Status/progress: In 2019, our carbon footprint per employee was 2.7 tons (2018: 3.0).","Treibhausgasemissionen pro Mitarbeiter, Allianz SE2 Status/Fortschritt: 2019 betrug unser CO2-Abdruck pro Mitarbeiter 2,7 (2018: 3,0) Tonnen.",0.8814519047737122
"This represents a 4 % reduction against the 2016 baseline1, due to improvements in energy efficiency, internal initiatives to manage business travel and an increase in head- count.","Dies entspricht einer Senkung um 4 % (Re- ferenzjahr 2016)1 durch Verbesserungen in der Energieeffizienz, interne Initiativen, um Geschäftsreisen zu reduzieren, sowie einen Anstieg der Mitarbeiterzahl.",0.8824402093887329
"Target: Reduce carbon emissions by 2 % per employee by 2020, against a 2016 baseline1.",Ziel: Die CO2-Emissionen pro Mitarbeiter wollen wir bis 2020 um 2 % reduzieren (Referenzjahr 2016)1.,0.896651029586792
"Status/progress: In 2019, we achieved a share of 49 % green elec- tricity in the total electricity used (2018: 45 %); this is due to the ex- pansion of green electricity use in the U.S. and Europe.",Status/Fortschritt: 2019 lag der Anteil von Grünstrom am gesam- ten Stromverbrauch bei 49 % (2018: 45 %) aufgrund der Auswei- tung von Grünstrom in den Vereinigten Staaten und Europa.,0.8686987161636353
"Status/progress: In 2019, we achieved a share of 100 % green elec- tricity in the total electricity used (2018: 100 %) at our Munich head- quarters, which are certified to ISO 14001.","Status/Fortschritt: 2019 lag der Anteil von Grünstrom am gesam- ten Stromverbrauch bei 100 % (2018: 100 %) an unserem Haupt- standort München, der nach ISO 14001 zertifiziert ist.",0.8671273589134216
This enables performance monitoring as well as comparison and benchmarking of entities using comparable system boundaries.,Dies ermöglicht sowohl Performance-Monitoring als auch Vergleiche und Benchmarking von Gesellschaften durch die Verwendung ver- gleichbarer Systemgrenzen.,0.9104044437408447
"Please note that the reported CO2 values refer to the sum of Scope 1, 2, and 3 based on the Greenhouse Gas (GHG) Protocol.","Zu beachten ist, dass berichtete CO2- Werte sich auf die Summe aus Scope 1, 2 und 3, basierend auf dem Greenhouse Gas (GHG) Protocol, beziehen.",0.9341930150985718
"CO2 emissions considered for Scope 3 are business travel, paper use, and energy-re- lated emissions such as transmission and distribution losses.","Scope 3 beinhaltet CO2- Emissionen durch Geschäftsreisen, Papierverbrauch sowie energiebe- zogene Emissionen durch Übertragungs- und Verteilungsverluste.",0.8945242166519165
Scope 2 emissions are calculated based on market-based factors and Allianz applies CO2 conversion factors mainly from IEA and DEFRA.,"Scope-2-Emissionen werden auf Grundlage marktbasierter Faktoren berechnet, wobei die Allianz hauptsächlich CO2-Umrechnungsfakto- ren der IEA und des DEFRA verwendet.",0.9120539426803589
The majority of the environmental impacts reported are in scope of an SE environmental management system certified to ISO14001.,Die gemeldeten SE-Umweltauswirkungen liegen im Geltungsbereich eines nach ISO14001 zertifizierten Umweltmanagementsystems.,0.8858239650726318
"Pooling risks is at the heart of our business model, and we have a keen interest in creat- ing stable communities.","Risiken zu bündeln ist der Kern unseres Geschäfts- modells, und wir haben ein starkes Interesse daran, stabile Gemein- schaften mitzugestalten.",0.8651200532913208
"a partnership with SOS Children’s Villages International, our Social Innovation Fund, and the Allianz Future Generations Award.","die Partnerschaft mit SOS-Kinderdorf International, den Allianz Social Innovation Fund und den Allianz Future Generations Award.",0.9183169603347778
"In the past three years, we granted funds to 26 social projects across the globe through our Social Innovation Fund, and col- laborated with impact-oriented ventures through the Allianz Future Generations Award.",Über unseren Social Innovation Fund unterstützten wir in den letzten drei Jahren 26 soziale Projekte weltweit und kooperier- ten mit sozialen Unternehmen durch den Allianz Future Gene- rations Award.,0.8796463012695312
"For further details on our Encour- aging Future Generations Program, please refer to our Sus- tainability Report 2019, section 02.3 and section 04.9.",Weitere Details zu unserem „Encouraging Fu- ture Generations“-Programm entnehmen Sie bitte unserem Nachhaltigkeitsbericht 2019 in Abschnitt 02.3 und Ab- schnitt 04.9.,0.8555867075920105
Increase our reach to children and youth by 2020 in line with our Corporate Citizenship strategy.,"Bis 2020 planen wir, im Rahmen unserer Corporate Citizenship Strategie mehr Kinder und Jugendliche zu erreichen.",0.8880457878112793
Further information on the Allianz Emerging Consumer con- cept is disclosed in the Emerging Consumers Report.,Weitere Informationen zum Allianz Emerging Consumers Konzept werden im Emerging Consumers Report veröffentlicht.,0.8932387828826904
"Status/progress: Allianz continues to expand its access to emerging consumers with new digital offerings by collaborating with insurtechs, mobile network operators, mobility platforms, and other digitally operating partners.","Status/Fortschritt: Die Allianz weitet ihren Zugang zu Emerging Consumers durch neue digitale Angebote aus, indem sie mit Insur- techs, Mobilfunkanbietern, Mobilitätsplattformen und anderen di- gital operierenden Unternehmen zusammenarbeitet.",0.8786160945892334
"Target: We aim to continue our expansion in Africa, Asia, and Latin America and to support a growing number of emerging consumers.","Ziel: Wir beabsichtigen, mit unserer Marktexpansion in Afrika, Asien und Lateinamerika fortzufahren und eine steigende Zahl an Emerging Consumers zu unterstützen.",0.8793978691101074
"This trust depends on the quality of our products, the way we inform and advise our customers, and the personal conduct and capability of our sales employees and representatives.","Dieses Vertrauen basiert auf der Qualität unserer Produkte, der Art und Weise, wie wir mit unseren Kunden spre- chen und sie beraten sowie auf dem persönlichen Verhalten und der Kompetenz unserer Vertriebsmitarbeiter und Vertreter.",0.8738315105438232
"Since 2011, we have had a global Sales Compliance Program in place, which describes standardized processes and controls for com- munication, monitoring, and review.","Seit 2011 verfügen wir über ein globales Sales Compliance Pro- gramm, welches standardisierte Prozesse und Kontrollen für die Kom- munikation, das Monitoring und die Prüfung beschreibt.",0.9065897464752197
"Since 2006, we have been measuring customer loyalty using the Net Promoter Score (NPS).",Seit 2006 erfassen wir die Kundenloyalität mit dem Net Promoter Score (NPS).,0.9202136397361755
"All NPS and customer feedback-related matters are managed by the Group Strategy, Marketing, Distribution team.","Alle NPS- und kundenbezogenen Themen werden von Group Strategy, Marketing, Distribution gesteuert.",0.9015752673149109
Status/progress: The Allianz Standard for Retail Risk Management outlines rules and principles to ensure that Allianz companies offer fair and transparent products.,"Status/Fortschritt: Der Allianz Standard for Retail Risk Manage- ment beschreibt Regeln und Prinzipien, um sicherzustellen, dass Allianz-Unternehmen faire und transparente Produkte anbieten.",0.9392288327217102
Target: Adjust the overall Sales Compliance Framework to simplify and consolidate this framework.,Ziel: Wir werden das übergreifende Sales Compliance Framework vereinfachen und konsolidieren.,0.8855004906654358
"We embrace the resulting opportunities through our Digital by Default strategy, which was implemented along with our Data Privacy Renewal Agenda in 2015.","Die daraus resultierenden Chancen nutzen wir durch unsere Strategie „Digital by Default“, die wir 2015 im Rahmen unserer Datenschutz Renewal Agenda auf den Weg gebracht haben.",0.9315347075462341
"Digitalization, however, also comes with data privacy and protection risks.",Die zunehmende Digitalisierung geht jedoch mit Datenschutz- und Datensicherheitsrisiken einher.,0.8718553781509399
The Allianz Privacy Standard defines rules and principles for collecting and processing personal data.,Der Datenschutzstandard der Allianz legt Regeln und Grundsätze für die Erhebung und Verarbeitung personenbezogener Daten fest.,0.9001105427742004
"In conjunction with training sessions, the PIA tool permits a more uniform approach to the assess- ment and mitigation of privacy risks across the Allianz Group.",In Ver- bindung mit Schulungen ermöglicht das PIA-Tool einen einheitlicheren Ansatz für die Bewertung und Minderung von Datenschutzrisiken in- nerhalb des Allianz Konzerns.,0.8639323115348816
Privacy risks are also included in Allianz’s Integrated Risk and Control System (IRCS).,Datenschutzrisiken sind ferner Bestand- teil des Integrated Risk and Control Systems (IRCS) der Allianz.,0.9174279570579529
"This standard specifies various requirements for three fields: vulnerability assessment along the software development value chain (including penetration tests and security audits), systems monitoring via multi-level security systems, and effective IT security management and business continuity manage- ment.","Diese Norm wiederum definiert verschiedene Anforderungen für die folgenden drei Bereiche: Schwachstellenanalyse entlang der Wertschöpfungskette der Soft- wareentwicklung (einschließlich Penetrationstests und Sicherheitsprü- fungen), Systemüberwachung mittels mehrstufiger Sicherheitssysteme sowie effektives IT-Sicherheitsmanagement und Business-Continuity- Management.",0.8856523633003235
"More recently, we have addressed new data privacy developments in Brazil, India, and the United States, among other jurisdictions.","Zuletzt haben wir neue Entwicklungen im Datenschutz unter anderem in Brasilien, Indien sowie in den Vereinigten Staaten adressiert.",0.8565518856048584
"In response to the unique ethical issues posed by Allianz’s digital en- deavors, in 2019, a data ethics working group was established to guide the ethical implementation of digital solutions into our businesses.","Als Reaktion auf die spezifischen ethischen Herausfor- derungen, die sich aus den digitalen Bestrebungen der Allianz erge- ben, wurde 2019 ein Arbeitskreis zum Thema Datenethik gebildet, um die Implementierung digitaler Lösungen innerhalb unserer Geschäfts- bereiche entsprechend ethischer Grundsätze zu begleiten.",0.8510540127754211
"During 2019, we continued the efforts begun in 2016, as we worked with Allianz Group companies and other Group centers on the group-wide implementation of the APRP.",2019 haben wir die 2016 begonnenen Anstrengungen fortge- setzt und mit Unternehmen des Allianz Konzerns und weiteren Konzernabteilungen an der konzernweiten Implementierung des APRP gearbeitet.,0.8586140275001526
"As we approached full implementation of the APRP in the European Economic Area, we began the transition to a business-as-usual environ- ment.","Da wir uns der vollen Implementierung von APRP im Europäischen Wirtschaftsraum angenähert ha- ben, haben wir mit dem Übergang zu einem normalen Betrieb begonnen.",0.8863177299499512
Implement the APRP across all Allianz Group companies by mid- 2020.,Implementierung des APRP in allen Unternehmen des Allianz Konzerns bis Mitte 2020.,0.9589309096336365
"This section describes the impact of human rights issues on our business activities and relationships, as well as the impact of Allianz’s activities and relationships on human rights issues.",In diesem Abschnitt beschreiben wir die Auswirkungen von Menschen- rechtsfragen auf unsere geschäftlichen Aktivitäten und Beziehungen sowie die Auswirkungen von Geschäftsaktivitäten und -beziehungen der Allianz auf Menschenrechtsfragen.,0.9220271110534668
"As a participant in the United Nations Global Compact since 2002, we have integrated its ten principles into our globally binding Code of Conduct.",Seit unserem Beitritt zum UN Global Compact 2002 haben wir die darin formulierten zehn Prinzipien in unseren weltweit bindenden Verhaltenskodex aufgenommen.,0.8575631976127625
"In its 2018 Allianz Group – Modern Slavery Statement, the Group confirms that over the five preceding years, no incident of modern slavery, human trafficking, or child labor has been found involv- ing any of the Allianz Group entities.","In der Erklä- rung des Allianz Konzerns gegen moderne Sklaverei aus dem Jahr 2018 bestätigen wir, dass für die fünf vorhergehenden Jahre aus keiner Konzerneinheit irgendwelche Vorfälle von moderner Sklaverei, Men- schenhandel oder Kinderarbeit gemeldet wurden.",0.868834376335144
"For further details, please refer to our Sustainability Report 2019, section 02.4 or our ESG Integration Framework.",Einzelheiten entnehmen Sie bitte unserem Nachhal- tigkeitsbericht 2019 im Abschnitt 02.4 oder unserem ESG Integration Framework.,0.865556001663208
"Without them, it would be impossible to deliver on our business strategy and achieve our goals.","Ohne sie wäre es unmöglich, unsere Geschäftsstrategie umzusetzen und unsere Ziele zu erreichen.",0.892082929611206
"In all these aspects, the Allianz Engagement Survey (AES), introduced in 2010, has been established as a valuable employee feedback platform.",Diesbezüglich hat sich der 2010 eingeführte Allianz En- gagement Survey (AES) als wertvolle Plattform für Mitarbeiterfeed- back erwiesen.,0.8767682909965515
"As of 2015, the IMIX comprises 10 AES items covering the areas of leadership, performance, and corporate culture.","Seit 2015 enthält der IMIX zehn Elemente des AES in den Bereichen Füh- rung, Performance sowie Unternehmenskultur.",0.8840342164039612
The results of the AES (and thus the IMIX) are directly linked to the performance objectives of the Group’s Board of Management.,Die Ergebnisse des AES (und damit auch des IMIX) sind direkt mit den Leistungszielen der Mitglieder des Konzernvorstandes verbunden.,0.8878897428512573
Status/progress: 73 % IMIX score in 2019 (+ 2 %-p).,Status/Fortschritt: 73 % IMIX-Wert in 2019 (+ 2 Prozentpunkte).,0.9499784708023071
Target: IMIX of 73 % plus in 2021.,Ziel: IMIX von 73 % plus in 2021.,0.9659254550933838
Status/progress: 73 % IMIX score in 2019 (+ 4 %-p).,Status/Fortschritt: 73 % IMIX-Wert in 2019 (+ 2 Prozentpunkte).,0.8734105825424194
Target: IMIX of 72 % in 2021.,Ziel: IMIX von 72 % in 2021.,0.9644479751586914
"Although 2021 targets were already reached this year for Allianz SE, the VOICE initiative will be continued to improve results further.","Obwohl die Ziele für 2021 für die Allianz SE bereits dieses Jahr erreicht wurden, wird die VOICE-Initiative fortgeführt, um die Ergebnisse wei- terhin zu verbessern.",0.9311484098434448
"We take a proactive stance, working with organizations such as the German Institute for Compliance and the Global Insurance Chief Com- pliance Officers Forum (CCO Forum) to enhance our understanding of compliance issues and to share best practices.","Um unser Verständnis für Com- pliance-Themen zu verbessern und bewährte Arbeitsweisen unterei- nander auszutauschen, arbeiten wir mit Organisationen wie dem Deutschen Institut für Compliance (DICO) und dem Global Insurance Chief Compliance Officers‘ Forum (CCO Forum) zusammen.",0.8673179745674133
Compliance risk is covered as part of the operational risk in Allianz’s Integrated Risk and Control System (IRCS).,Das Compliance-Risiko wird als Teil des operationellen Risikos im Integrated Risk und Control System (IRCS) der Allianz adressiert.,0.946421205997467
"Since 2017, all relevant entities conducted an annual compliance risk assessment based on the compliance risk scenarios, which together with the maturity assessments form the annual cycle of our integrated compliance risk scoping and assessment activities.","Seit 2017 haben alle relevanten Einheiten eine jährliche Compliance-Risi- kobewertung auf der Grundlage der Compliance-Risiko-Szenarien durchgeführt, die zusammen mit unseren Programmstatusprüfungen den Jahreszyklus unserer integrierten Aktivitäten zur Erfassung und Bewertung von Compliance-Risiken bilden.",0.88307785987854
"In 2019, for the third cycle, the following top inherent compliance risks were identified: In view of new and upcoming regulatory requirements, and expecta- tions, the compliance risks associated with IT regulations, increased oversight requirements and conduct-related standards are growing in significance.","Im Jahr 2019, dem dritten Zyklus, wurden die folgenden wichtigsten inhärenten Compliance-Ri- siken identifiziert: Mit Blick auf neue und bevorstehende regulatorische Anforderungen und Erwartungen erlangen Compliance-Risiken im Kontext von IT-Re- gulierung, erhöhten Aufsichtsvorgaben sowie verhaltensbezogenen Standards immer größere Bedeutung.",0.878137469291687
