english,german,similarity
"Ltd., Singapore Allianz do Brasil Participações Ltda., São Paulo Allianz Edukacja S.A., Warsaw Allianz Elementar Lebensversicherungs- Aktiengesellschaft, Vienna Allianz Elementar Versicherungs- Aktiengesellschaft, Vienna Allianz EM Loans S.C.S., Luxembourg Allianz Engineering Inspection Services Limited, Guildford Allianz Equity Emerging Markets 1, Paris Allianz Equity Investments Ltd., Guildford Allianz Equity Large Cap EMU, Paris Allianz Euro Core Infrastructure Debt GP S.à r.l., Senningerberg Allianz Europe B.V., Amsterdam Allianz Europe Conviction Equity, Senningerberg Allianz Europe Ltd., Amsterdam Allianz Europe Small and Micro Cap Equity, Senningerberg Allianz Finance Corporation, Wilmington, DE Allianz Finance II B.V., Amsterdam Allianz Finance II Luxembourg S.à r.l., Luxembourg Allianz Finance III B.V., Amsterdam Allianz Finance IV Luxembourg S.à r.l., Luxembourg Allianz Finance IX Luxembourg S.A., Luxembourg Allianz Finance Pty Ltd., Sydney Allianz Finance VII Luxembourg S.A., Luxembourg Allianz Finance VIII Luxembourg S.A., Luxembourg Allianz FinanzPlan 2055, Senningerberg Allianz Fire and Marine Insurance Japan Ltd., Tokyo Allianz Fixed Income Macro Fund, London Allianz Foglalkoztatói Nyugdíjszolgáltató Zrt., Budapest Allianz France Favart I, Paris Allianz France Investissement OPCI, Paris la Défense Allianz France Real Estate Invest SPPICAV, Paris la Défense Allianz France Richelieu 1 S.A.S., Paris la Défense Allianz France S.A., Paris la Défense Allianz France US REIT GP LLC, Wilmington, DE Allianz France US REIT LP, Wilmington, DE Allianz Fund Administration and Management B.V., Rotterdam Allianz Fund Investments 2 S.A. (Compartment), Luxembourg Allianz Fund Investments Inc., Wilmington, DE Allianz Fund Investments S.A., Luxembourg Allianz Garantie Fonds 3%, Rotterdam owned1 100.0 100.0 3 100.0 100.0 100.0 100.0 100.0 100.0 100.0 100.0 3 100.0 100.0 3 100.0 100.0 50.7 3 100.0 100.0 3 100.0 100.0 100.0 100.0 100.0 100.0 100.0 100.0 100.0 49.2 2,3 100.0 99.0 3 100.0 100.0 3 100.0 100.0 100.0 100.0 100.0 100.0 100.0 100.0 100.0 100.0 100.0 3 Allianz Garantie Fonds 4,75%, Rotterdam Allianz General Insurance Co. Ltd., Bangkok Allianz General Insurance Company (Malaysia) Allianz General Laos Ltd., Vientiane Allianz Global AC Equity Insights Fund, London Allianz Global Aggregate Bond, Senningerberg Allianz Global Corporate & Specialty do Brasil Participações Ltda., Rio de Janeiro D _ Consolidated Financial Statements owned1 Allianz Global Corporate & Specialty of Africa (Proprietary) Ltd., Johannesburg 100.0 Allianz Global Corporate & Specialty of Bermuda Ltd., Hamilton 100.0 Allianz Global Corporate & Specialty South Africa Ltd., Johannesburg 100.0 Allianz Global Fundamental Strategy, Senningerberg 43.7 2,3 Allianz Global Government Bond, Senningerberg 99.3 3 Allianz Global Investors Asia Pacific Ltd., Hong Kong 100.0 Allianz Global Investors Asset Management (Shanghai) Limited, Shanghai 100.0 Allianz Global Investors Distributors LLC, Dover, DE 100.0 Allianz Global Investors Holdings Ltd., London 100.0 Allianz Global Investors Ireland Ltd., Dublin 100.0 Allianz Global Investors Japan Co. Ltd., Tokyo 100.0 Allianz Global Investors Nominee Services Ltd., George Town 100.0 Allianz Global Investors Overseas Asset Management (Shanghai) Limited, Shanghai 100.0 Allianz Global Investors Schweiz AG, Zurich 100.0 Allianz Global Investors Singapore Ltd., Singapore 100.0 Allianz Global Investors Taiwan Ltd., Taipei 100.0 Allianz Global Investors U.S. Holdings LLC, Dover, DE 100.0 Allianz Global Investors U.S. LLC, Dover, DE 100.0 Allianz Global Investors UK Limited, London 100.0 Allianz Global Life dac, Dublin 100.0 Allianz Global Opportunistic Bond, Senningerberg 59.2 3 Allianz Global Risks US Insurance Company Corp., Chicago, IL 100.0 Allianz Groen Rente Fonds, Rotterdam 100.0 3 Allianz Hayat ve Emeklilik A.S., Istanbul 89.0 Allianz Hellas Insurance Company S.A., Athens 100.0 Allianz Hold Co Real Estate S.à r.l., Luxembourg 100.0 Allianz Holding eins GmbH, Vienna 100.0 Allianz Holding France SAS, Paris la Défense 100.0 Allianz Holdings p.l.c., Dublin 100.0 Allianz Holdings plc, Guildford 100.0 Allianz Hospitaliers Euro, Paris 100.0 3 Allianz Hospitaliers Valeurs Durables, Paris 100.0 3 Allianz Hrvatska d.d., Zagreb 83.2 Allianz Hungária Biztosító Zrt., Budapest 100.0 Allianz HY Investor GP LLC, Wilmington, DE 100.0 Allianz HY Investor LP, Wilmington, DE 100.0 Allianz IARD EM Debt, Paris 100.0 3 Allianz IARD S.A., Paris la Défense 100.0 Allianz IARD Vintage, Paris 100.0 3 Allianz Impact Green Bond, Paris 100.0 3 Allianz Impact Investment Fund S.A. SICAV-RAIF, Senningerberg 100.0 3 Allianz IndexManagement Balance, Senningerberg 97.3 3 Allianz Individual Insurance Group LLC, Allianz Informatique G.I.E., Paris la Défense Allianz Infrastructure Czech HoldCo I S.à r.l., Allianz Infrastructure Czech HoldCo II S.à r.l., D _ Consolidated Financial Statements Allianz Infrastructure Holding I Pte.","Ltd., Singapur Allianz do Brasil Participações Ltda., São Paulo Allianz Edukacja S.A., Warschau Allianz Elementar Lebensversicherungs- Aktiengesellschaft, Wien Allianz Elementar Versicherungs- Aktiengesellschaft, Wien Allianz EM Loans S.C.S., Luxemburg Allianz Engineering Inspection Services Limited, Guildford Allianz Equity Emerging Markets 1, Paris Allianz Equity Investments Ltd., Guildford Allianz Equity Large Cap EMU, Paris Allianz Euro Core Infrastructure Debt GP S.à r.l., Senningerberg Allianz Europe B.V., Amsterdam Allianz Europe Conviction Equity, Senningerberg Allianz Europe Ltd., Amsterdam Allianz Europe Small and Micro Cap Equity, Senningerberg Allianz Finance Corporation, Wilmington, DE Allianz Finance II B.V., Amsterdam Allianz Finance II Luxembourg S.à r.l., Luxemburg Allianz Finance III B.V., Amsterdam Allianz Finance IV Luxembourg S.à r.l., Luxemburg Allianz Finance IX Luxembourg S.A., Luxemburg Allianz Finance Pty Ltd., Sydney Allianz Finance VII Luxembourg S.A., Luxemburg Allianz Finance VIII Luxembourg S.A., Luxemburg Allianz FinanzPlan 2055, Senningerberg Allianz Fire and Marine Insurance Japan Ltd., Tokio Allianz Fixed Income Macro Fund, London Allianz Foglalkoztatói Nyugdíjszolgáltató Zrt., Budapest Allianz France Favart I, Paris Allianz France Investissement OPCI, Paris la Défense Allianz France Real Estate Invest SPPICAV, Paris la Défense Allianz France Richelieu 1 S.A.S., Paris la Défense Allianz France S.A., Paris la Défense Allianz France US REIT GP LLC, Wilmington, DE Allianz France US REIT LP, Wilmington, DE Allianz Fund Administration and Management B.V., Rotterdam Allianz Fund Investments 2 S.A. (Compartment), Quote1 100,0 3 100,0 99,9 100,0 100,0 100,0 3 100,0 100,0 100,0 100,0 100,0 100,0 100,0 100,0 3 100,0 100,0 3 100,0 100,0 50,7 3 100,0 100,0 3 100,0 100,0 100,0 100,0 100,0 100,0 100,0 100,0 100,0 49,2 2,3 100,0 99,0 3 100,0 100,0 3 100,0 100,0 100,0 100,0 100,0 100,0 100,0 Allianz Fund Investments Inc., Wilmington, DE Allianz Fund Investments S.A., Luxemburg Allianz Garantie Fonds 3%, Rotterdam Allianz Garantie Fonds 4,75%, Rotterdam Allianz General Insurance Co. Ltd., Bangkok Allianz General Insurance Company (Malaysia) Allianz General Laos Ltd., Vientiane Quote1 Allianz Global AC Equity Insights Fund, London 97,0 3 Allianz Global Aggregate Bond, Senningerberg 98,6 3 Allianz Global Corporate & Specialty do Brasil Participações Ltda., Rio de Janeiro 100,0 Allianz Global Corporate & Specialty of Africa (Proprietary) Ltd., Johannesburg 100,0 Allianz Global Corporate & Specialty of Bermuda Ltd., Hamilton 100,0 Allianz Global Corporate & Specialty South Africa Ltd., Johannesburg 100,0 Allianz Global Fundamental Strategy, Senningerberg 43,7 2,3 Allianz Global Government Bond, Senningerberg 99,3 3 Allianz Global Investors Asia Pacific Ltd., Hongkong 100,0 Allianz Global Investors Asset Management (Shanghai) Limited, Shanghai 100,0 Allianz Global Investors Distributors LLC, Dover, DE 100,0 Allianz Global Investors Holdings Ltd., London 100,0 Allianz Global Investors Ireland Ltd., Dublin 100,0 Allianz Global Investors Japan Co. Ltd., Tokio 100,0 Allianz Global Investors Nominee Services Ltd., George Town 100,0 Allianz Global Investors Overseas Asset Management (Shanghai) Limited, Shanghai 100,0 Allianz Global Investors Schweiz AG, Zürich 100,0 Allianz Global Investors Singapore Ltd., Singapur 100,0 Allianz Global Investors Taiwan Ltd., Taipeh 100,0 Allianz Global Investors U.S. Holdings LLC, Dover, DE 100,0 Allianz Global Investors U.S. LLC, Dover, DE 100,0 Allianz Global Investors UK Limited, London 100,0 Allianz Global Life dac, Dublin 100,0 Allianz Global Opportunistic Bond, Senningerberg 59,2 3 Allianz Global Risks US Insurance Company Corp., Chicago, IL 100,0 Allianz Groen Rente Fonds, Rotterdam 100,0 3 Allianz Hayat ve Emeklilik A.S., Istanbul 89,0 Allianz Hellas Insurance Company S.A., Athen 100,0 Allianz Hold Co Real Estate S.à r.l., Luxemburg 100,0 Allianz Holding eins GmbH, Wien 100,0 Allianz Holding France SAS, Paris la Défense 100,0 Allianz Holdings p.l.c., Dublin 100,0 Allianz Holdings plc, Guildford 100,0 Allianz Hospitaliers Euro, Paris 100,0 3 Allianz Hospitaliers Valeurs Durables, Paris 100,0 3 Allianz Hrvatska d.d., Zagreb 83,2 Allianz Hungária Biztosító Zrt., Budapest 100,0 Allianz HY Investor GP LLC, Wilmington, DE 100,0 Allianz HY Investor LP, Wilmington, DE 100,0 Allianz IARD EM Debt, Paris 100,0 3 Allianz IARD S.A., Paris la Défense 100,0 Allianz IARD Vintage, Paris 100,0 3 Allianz Impact Green Bond, Paris 100,0 3 Allianz Impact Investment Fund S.A. SICAV-RAIF, Allianz Individual Insurance Group LLC, Allianz Informatique G.I.E., Paris la Défense Allianz Infrastructure Czech HoldCo I S.à r.l., Luxemburg Allianz Infrastructure Czech HoldCo II S.à r.l., Luxemburg Allianz Infrastructure Holding I Pte.",0.9973940849304199
"Ltd., Singapore Allianz Infrastructure Luxembourg Holdco I S.A., Luxembourg Allianz Infrastructure Luxembourg Holdco II S.A., Luxembourg Allianz Infrastructure Luxembourg Holdco III S.A., Luxembourg Allianz Infrastructure Luxembourg Holdco IV S.A., Luxembourg Allianz Infrastructure Luxembourg I S.à r.l., Luxembourg Allianz Infrastructure Norway Holdco I S.à r.l., Luxembourg Allianz Infrastructure Spain Holdco I S.à r.l., Luxembourg Allianz Infrastructure Spain Holdco II S.à r.l., Luxembourg Allianz Insurance Company of Ghana Limited, Accra Allianz Insurance Company of Kenya Limited, Nairobi Allianz Insurance Company-Egypt S.A.E., New Cairo Allianz Insurance Lanka Limited, Colombo Allianz Insurance plc, Guildford Allianz International Ltd., Guildford Allianz Inversiones S.A., Bogotá D.C. Allianz Invest 10 Division S/U, Vienna Allianz Invest 11 Division Leben/Kranken, Vienna Allianz Invest 12 Division Leben/Kranken, Vienna Allianz Invest 50, Vienna Allianz Invest Cash, Vienna Allianz Invest d.o.o., Zagreb Allianz Invest Kapitalanlagegesellschaft mbH, Vienna Allianz Invest Ostrent, Vienna Allianz Invest Spezial 3, Vienna Allianz Investment Management LLC, Minneapolis, MN Allianz Investment Real Estate Solutions S.à r.l., Luxembourg Allianz Investmentbank Aktiengesellschaft, Vienna Allianz Investments I Luxembourg S.à r.l., Luxembourg Allianz Investments II Luxembourg S.à r.l., Luxembourg Allianz Investments III Luxembourg S.A., Luxembourg Allianz Japan Equity Long Short Strategy, Senningerberg Allianz Jewel Fund ICAV, Dublin Allianz Jingdong General Insurance Company Ltd., Guangzhou Allianz kontakt s.r.o., Prague Allianz Leasing Bulgaria AD, Sofia % owned1 100.0 100.0 100.0 100.0 100.0 100.0 100.0 100.0 100.0 100.0 100.0 95.0 100.0 100.0 100.0 100.0 100.0 3 100.0 3 100.0 3 100.0 3 88.6 3 100.0 100.0 88.9 3 100.0 3 100.0 100.0 100.0 100.0 100.0 100.0 37.5 2,3 100.0 50.0 2 100.0 100.0 Allianz Leben Real Estate Holding I S.à r.l., Allianz Leben Real Estate Holding II S.à r.l., Allianz Life (Bermuda) Ltd., Hamilton Allianz Life Assurance Company-Egypt S.A.E., New Allianz Life Financial Services LLC, Minneapolis, Allianz Life Insurance Company Ltd., Moscow Allianz Life Insurance Company of Ghana Limited, Allianz Life Insurance Company of Missouri, Clayton, MO Allianz Life Insurance Company of New York, New York, NY Allianz Life Insurance Company of North America, Minneapolis, MN Allianz Life Insurance Japan Ltd., Tokyo Allianz Life Insurance Lanka Ltd., Colombo Allianz Life Insurance Malaysia Berhad p.l.c., Kuala Lumpur Allianz Life Luxembourg S.A., Luxembourg Allianz Madagascar Assurances SA, Antananarivo Allianz Malaysia Berhad p.l.c., Kuala Lumpur Allianz Management Services Limited, Guildford Allianz Marine & Transit Underwriting Agency Pty Ltd., Sydney Allianz Marine (UK) Ltd., Ipswich Allianz Maroc S.A., Casablanca Allianz MENA Holding (Bermuda) Ltd., Hamilton Allianz México S.A. Compañía de Seguros, Mexico City Allianz Mid Cap Loans FCT, Paris Allianz Multi Croissance, Paris Allianz Multi Dynamisme, Paris Allianz Multi Equilibre, Paris Allianz Multi Harmonie, Paris Allianz Multi Horizon 2024-2026, Paris Allianz Multi Horizon 2027-2029, Paris Allianz Multi Horizon 2030-2032, Paris Allianz Multi Horizon 2033-2035, Paris Allianz Multi Horizon 2036-2038, Paris Allianz Multi Horizon 2039-2041, Paris Allianz Multi Horizon Court Terme, Paris Allianz Multi Horizon Long Terme, Paris Allianz Multi Opportunités, Paris Allianz Multi Rendement Réel, Paris Allianz Mutual Funds Management Company S.A., Athens Allianz Nederland Groep N.V., Rotterdam Allianz New Europe Holding GmbH, Vienna Allianz New Zealand Limited, Auckland Allianz Nigeria Insurance plc, Lagos Allianz Obligations Internationales, Paris Allianz of America Inc., Wilmington, DE Allianz Offensief Mix Fonds, Rotterdam Allianz One Beacon GP LLC, Wilmington, DE Allianz One Beacon LP, Wilmington, DE Allianz Opéra, Paris Allianz Operations Singapore Pte.","Ltd., Singapur Allianz Infrastructure Luxembourg Holdco I S.A., Luxemburg Allianz Infrastructure Luxembourg Holdco II S.A., Luxemburg Allianz Infrastructure Luxembourg Holdco III S.A., Luxemburg Allianz Infrastructure Luxembourg Holdco IV S.A., Luxemburg Allianz Infrastructure Luxembourg I S.à r.l., Luxemburg Allianz Infrastructure Norway Holdco I S.à r.l., Luxemburg Allianz Infrastructure Spain Holdco I S.à r.l., Luxemburg Allianz Infrastructure Spain Holdco II S.à r.l., Luxemburg Allianz Insurance Company of Ghana Limited, Accra Allianz Insurance Company of Kenya Limited, Nairobi Allianz Insurance Company-Egypt S.A.E., Neu-Kairo Allianz Insurance Lanka Limited, Colombo Allianz Insurance plc, Guildford Allianz International Ltd., Guildford Allianz Inversiones S.A., Bogotá D.C. Allianz Invest 10 Division S/U, Wien Allianz Invest 11 Division Leben/Kranken, Wien Allianz Invest 12 Division Leben/Kranken, Wien Allianz Invest 50, Wien Allianz Invest Cash, Wien Allianz Invest d.o.o., Zagreb Allianz Invest Kapitalanlagegesellschaft mbH, Wien Allianz Invest Ostrent, Wien Allianz Invest Spezial 3, Wien Allianz Investment Management LLC, Minneapolis, MN Allianz Investment Real Estate Solutions S.à r.l., Luxemburg Allianz Investmentbank Aktiengesellschaft, Wien Allianz Investments I Luxembourg S.à r.l., Luxemburg Allianz Investments II Luxembourg S.à r.l., Luxemburg Allianz Investments III Luxembourg S.A., Luxemburg Allianz Japan Equity Long Short Strategy, Senningerberg Allianz Jewel Fund ICAV, Dublin Allianz Jingdong General Insurance Company Ltd., % Quote1 100,0 100,0 100,0 100,0 100,0 100,0 100,0 100,0 100,0 100,0 100,0 100,0 100,0 95,0 100,0 100,0 100,0 100,0 100,0 3 100,0 3 100,0 3 100,0 3 88,6 3 100,0 100,0 88,9 3 100,0 3 100,0 100,0 100,0 100,0 100,0 100,0 37,5 2,3 100,0 Allianz Leasing Bulgaria AD, Sofia Allianz Leben Real Estate Holding I S.à r.l., Allianz Leben Real Estate Holding II S.à r.l., Allianz Life (Bermuda) Ltd., Hamilton Allianz Life Assurance Company-Egypt S.A.E., Neu- Allianz Life Financial Services LLC, Minneapolis, Allianz Life Insurance Company Ltd., Moskau Allianz Life Insurance Company of Ghana Limited, Accra Allianz Life Insurance Company of Missouri, Clayton, MO Allianz Life Insurance Company of New York, New York, NY Allianz Life Insurance Company of North America, Minneapolis, MN Allianz Life Insurance Japan Ltd., Tokio Allianz Life Insurance Lanka Ltd., Colombo Allianz Life Insurance Malaysia Berhad p.l.c., Kuala Lumpur Allianz Life Luxembourg S.A., Luxemburg Allianz Madagascar Assurances SA, Antananarivo Allianz Malaysia Berhad p.l.c., Kuala Lumpur Allianz Management Services Limited, Guildford Allianz Marine & Transit Underwriting Agency Pty Ltd., Sydney Allianz Marine (UK) Ltd., Ipswich Allianz Maroc S.A., Casablanca Allianz MENA Holding (Bermuda) Ltd., Hamilton Allianz México S.A. Compañía de Seguros, Mexiko- Stadt Allianz Mid Cap Loans FCT, Paris Allianz Multi Croissance, Paris Allianz Multi Dynamisme, Paris Allianz Multi Equilibre, Paris Allianz Multi Harmonie, Paris Allianz Multi Horizon 2024-2026, Paris Allianz Multi Horizon 2027-2029, Paris Allianz Multi Horizon 2030-2032, Paris Allianz Multi Horizon 2033-2035, Paris Allianz Multi Horizon 2036-2038, Paris Allianz Multi Horizon 2039-2041, Paris Allianz Multi Horizon Court Terme, Paris Allianz Multi Horizon Long Terme, Paris Allianz Multi Opportunités, Paris Allianz Multi Rendement Réel, Paris Allianz Mutual Funds Management Company S.A., Athen Allianz Nederland Groep N.V., Rotterdam Allianz New Europe Holding GmbH, Wien Allianz New Zealand Limited, Auckland Allianz Nigeria Insurance plc, Lagos Allianz Obligations Internationales, Paris Allianz of America Inc., Wilmington, DE Allianz Offensief Mix Fonds, Rotterdam Allianz One Beacon GP LLC, Wilmington, DE Allianz One Beacon LP, Wilmington, DE Allianz Opéra, Paris Allianz Operations Singapore Pte.",0.9980208277702332
"z o.o., Warsaw owned1 Allianz Popular Asset Management SGIIC S.A., Madrid 100.0 Allianz Popular Pensiones EGFP S.A., Madrid 100.0 Allianz Popular S.L., Madrid 60.0 Allianz Popular Vida Compañía de Seguros y Reaseguros S.A., Madrid 100.0 Allianz Presse Infra GP S.à r.l., Luxembourg 92.4 Allianz Presse Infra S.C.S., Luxembourg 92.4 Allianz Presse US REIT GP LLC, Wilmington, DE 92.4 Allianz Presse US REIT LP, Wilmington, DE 92.4 Allianz Private Credit Fund S.A. SICAV-RAIF, Senningerberg 100.0 3 Allianz Private Equity Partners Europa II, Milan 92.0 3 Allianz Private Equity Partners Europa III, Milan 99.6 3 Allianz Private Equity Partners IV, Milan 100.0 3 Allianz Private Equity Partners V, Milan 100.0 3 Allianz Properties Limited, Guildford 100.0 Allianz Re Dublin dac, Dublin 100.0 Allianz Real Estate Investment S.A., Luxembourg 100.0 Allianz Real Estate of America LLC, New York, NY 100.0 Allianz Real Estate Trust II (1), Sydney 99.2 3 Allianz Real Estate Trust II (2), Sydney 99.2 3 Allianz Real Estate Trust III (1), Sydney 97.9 3 Allianz Real Estate Trust III (2), Sydney 97.9 3 Allianz Reinsurance America Inc., Los Angeles, CA 100.0 Allianz Renewable Energy Fund III GP SCSp, Senningerberg 100.0 Allianz Renewable Energy Fund III Lux GP S.à r.l., Senningerberg 100.0 Allianz Renewable Energy Fund Management 1 Ltd., London 100.0 Allianz Renewable Energy Management AT GmbH, Pottenbrunn 100.0 Allianz Renewable Energy Management AT II GmbH, Pottenbrunn 100.0 Allianz Renewable Energy Partners I LP, London 100.0 Allianz Renewable Energy Partners II Limited, London 100.0 Allianz Renewable Energy Partners III LP, London 99.3 Allianz Renewable Energy Partners IV Limited, London 99.3 Allianz Renewable Energy Partners IX Limited, London 99.2 Allianz Renewable Energy Partners of America 2 LLC, Wilmington, DE 100.0 Allianz Renewable Energy Partners of America LLC, Wilmington, DE 100.0 Allianz Renewable Energy Partners V plc., London 100.0 Allianz Renewable Energy Partners VI Limited, London 100.0 Allianz Renewable Energy Partners VII LP, London 100.0 Allianz Renewable Energy Partners VIII Limited, London 100.0 Allianz Resilient Credit Euro Fund GP S.à r.l., Senningerberg 100.0 Allianz Resilient Credit UK GP Limited, London Allianz Risk Consultants Inc., Los Angeles, CA Allianz Risk Transfer (Bermuda) Ltd., Hamilton Allianz Risk Transfer (UK) Limited, London Allianz Risk Transfer AG, Schaan Allianz Risk Transfer Inc., New York, NY Allianz S.A. de C.V., Mexico City Allianz Saint Marc CL, Paris Allianz Sakura Multifamily 1 Pte.","z o.o., Warschau 100,0 Allianz Popular Asset Management SGIIC S.A., Madrid 100,0 Allianz Popular Pensiones EGFP S.A., Madrid 100,0 Allianz Popular S.L., Madrid 60,0 Allianz Popular Vida Compañía de Seguros y Reaseguros S.A., Madrid 100,0 Allianz Presse Infra GP S.à r.l., Luxemburg 92,4 Allianz Presse Infra S.C.S., Luxemburg 92,4 Allianz Presse US REIT GP LLC, Wilmington, DE 92,4 Allianz Presse US REIT LP, Wilmington, DE 92,4 Allianz Private Credit Fund S.A. SICAV-RAIF, Senningerberg 100,0 3 Allianz Private Equity Partners Europa II, Mailand 92,0 3 Allianz Private Equity Partners Europa III, Mailand 99,6 3 Allianz Private Equity Partners IV, Mailand 100,0 3 Allianz Private Equity Partners V, Mailand 100,0 3 Allianz Properties Limited, Guildford 100,0 Allianz Re Dublin dac, Dublin 100,0 Allianz Real Estate Investment S.A., Luxemburg 100,0 Allianz Real Estate of America LLC, New York, NY 100,0 Allianz Real Estate Trust II (1), Sydney 99,2 3 Allianz Real Estate Trust II (2), Sydney 99,2 3 Allianz Real Estate Trust III (1), Sydney 97,9 3 Allianz Real Estate Trust III (2), Sydney 97,9 3 Allianz Reinsurance America Inc., Los Angeles, CA 100,0 Allianz Renewable Energy Fund III GP SCSp, Senningerberg 100,0 Allianz Renewable Energy Fund III Lux GP S.à r.l., Senningerberg 100,0 Allianz Renewable Energy Fund Management 1 Ltd., London 100,0 Allianz Renewable Energy Management AT GmbH, Pottenbrunn 100,0 Allianz Renewable Energy Management AT II GmbH, Pottenbrunn 100,0 Allianz Renewable Energy Partners I LP, London 100,0 Allianz Renewable Energy Partners II Limited, London 100,0 Allianz Renewable Energy Partners III LP, London 99,3 Allianz Renewable Energy Partners IV Limited, London 99,3 Allianz Renewable Energy Partners IX Limited, London 99,2 Allianz Renewable Energy Partners of America 2 LLC, Wilmington, DE 100,0 Allianz Renewable Energy Partners of America LLC, Wilmington, DE 100,0 Allianz Renewable Energy Partners V plc., London 100,0 Allianz Renewable Energy Partners VI Limited, London 100,0 Allianz Renewable Energy Partners VII LP, London 100,0 Allianz Renewable Energy Partners VIII Limited, London 100,0 Allianz Resilient Credit Euro Fund GP S.à r.l., Allianz Resilient Credit UK GP Limited, London Allianz Risk Consultants Inc., Los Angeles, CA Allianz Risk Transfer (Bermuda) Ltd., Hamilton Allianz Risk Transfer (UK) Limited, London Allianz Risk Transfer AG, Schaan Allianz Risk Transfer Inc., New York, NY Allianz S.A. de C.V., Mexiko-Stadt Allianz Saint Marc CL, Paris Geschäftsbericht 2019 − Allianz Konzern Allianz Sakura Multifamily 1 Pte.",0.9762579798698425
"Ltd., Singapore Allianz Sakura Multifamily 3 Pte.","Ltd., Singapur Allianz Sakura Multifamily 3 Pte.",0.9973523020744324
