english,german,similarity
"Management actions – such as the acquisition of ADAC Autoversicherung AG, Liverpool Victoria General Insurance Group Lim- ited, Legal & General Insurance Limited, and Taikang – also contrib- uted to the increase in the Capital Requirement of the Group.","Ma- nagementmaßnahmen – wie der Erwerb der ADAC Autoversicherung AG, Liverpool Victoria General Insurance Group Limited, Legal & Gene- ral Insurance Limited und Taikang – trugen auch zur Erhöhung der Ka- pitalanforderung der Gruppe bei.",0.8611835837364197
"However, this was slightly damp- ened by management actions – in particular duration management measures – that improved the interest rate risk profile.","Dies wurde jedoch durch Managementmaßnahmen – insbesondere durch Maßnahmen des Durationsmanagements –, die das Zinsrisikoprofil verbesserten, leicht gedämpft.",0.9164248704910278
Real estate risk increased due to higher exposure in real estate and infrastructure in- vestments.,Das Immobilienrisiko erhöhte sich auf- grund des höheren Engagements bei Immobilien- und Infrastrukturin- vestitionen.,0.8651474714279175
"As of 31 December 2019, about 5.5 % (2018: 6.0 %) of the total pre- diversified risk was related to real estate exposures.","Dezember 2019 standen circa 5,5 % (2018: 6,0 %) des komplet- ten Risikos vor Diversifikation mit anderen Risikokategorien im Zusam- menhang mit Immobilienpositionen.",0.8516258597373962
The following table presents our group-wide risk figures for credit risks by business segment.,Die folgende Tabelle zeigt das zugeordnete Konzernkreditrisiko nach Geschäftsbereich.,0.8539913296699524
The overall credit risk for the Allianz Group increased by € 0.6 bn to € 5.5 bn (2018: € 4.9 bn).,"Insgesamt erhöhte sich das Kreditrisiko auf Konzernebene um 0,6 Mrd € auf 5,5 Mrd € (2018: 4,9 Mrd €).",0.8503573536872864
2_2018 risk profile figures adjusted based on the impact of the 2019 model changes.,2_Die Risikoprofilzahlen für 2018 wurden basierend auf den Auswirkungen der Modelländerungen für 2019 angepasst.,0.9543375372886658
"The top three perils contributing to the natural catastrophe risk as of 31 December 2019 were: windstorms in Europe, floods in Germany, and earthquakes in Australia.","Dezember 2019 hatten die folgenden drei Gefahren den größten Anteil am Naturkatastrophenrisiko: Stürme in Europa, Über- flutungen in Deutschland und Erdbeben in Australien.",0.9058604836463928
"As can be inferred from the section on the management of liquidity risks, while these are quantified and monitored through regular stress test reporting as well as properly managed, they are not quantified for risk capital purposes.","Wie aus dem Ab- schnitt über das Management von Liquiditätsrisiken hervorgeht, wer- den sie durch ein regelmäßiges Stresstestberichtswesen quantifiziert, überwacht sowie ordnungsgemäß gesteuert, aber nicht für Risikokapitalzwecke quantifiziert.",0.8633853197097778
"The IT controls are based on COBIT 5 and include, for example, controls for access right management, project and change management.","Die IT-Kontrollen ba- sieren auf COBIT 5 und beinhalten beispielsweise Kontrollen zur Über- wachung von Zugriffsrechten, Projekt- und Change Management.",0.9199199080467224
"In addition, our Enti- tiy-Level Control Assessments (ELCA) framework contains controls to monitor the effectiveness of our system of governance.","Zu- sätzlich beinhaltet unser Entity Level Control Assessment (ELCA) Rah- menwerk Kontrollen, um die Effektivität des Governance-Systems zu überwachen.",0.8744921684265137
The method- ology is described in our IRCS Guideline.,Diese Methodik ist in unserer IRCS-Guideline beschrieben.,0.9099422693252563
"In addition to the quantitative cal- culation, we also consider qualitative criteria, such as the expected increase in business volume or the complexity of transactions.","Neben der quantitativen Betrachtung berücksichtigen wir auch qualitative Kriterien, wie etwa die Wachs- tumsaussichten des betreffenden Geschäfts oder die Komplexität einzelner Transaktionen.",0.8624873161315918
"2_In the second quarter of 2019, a dividend of € 9.00 (2018: € 8.00) per qualifying share was paid to the shareholders.","2_Im zweiten Quartal 2019 wurde eine Dividende in Höhe von 9,00 (2018: 8,00) € je gewinnberechtigter Stückaktie an die Anteilseigner ausgeschüttet.",0.9098847508430481
"3_For further information regarding the share buy-back program 2019, please refer to note 19.",3_Detaillierte Informationen bezüglich des Aktienrückkaufprogramms 2019 finden sich in Angabe 19.,0.8617857694625854
The Allianz Group’s presen- tation currency is the Euro (€).,Die Berichtswährung des Allianz Konzerns ist der Euro (€).,0.8757564425468445
"The Allianz Group offers property-casualty insurance, life/health insurance, and asset management products and services in over 70 countries.","Der Allianz Konzern bietet in über 70 Ländern Produkte und Dienstleistungen in den Bereichen Schaden- und Unfallversicherung, Lebens- und Krankenversicherung sowie Asset Management an.",0.9302767515182495
"Subsidiaries are usually entities where Allianz SE, directly or indirectly, owns more than half of the voting rights or similar rights with the ability to affect the returns of these entities for its own benefit.","Konzernunternehmen sind im Regelfall die Gesellschaften, von denen die Allianz SE direkt oder indirekt mehr als die Hälfte der Stimmrechte oder ähnliche Rechte besitzt und deren Überschüsse sie dadurch zu ihrem eigenen Vorteil beeinflussen kann.",0.8593253493309021
"In such cases, the investment fund qualifies as subsidiary if the Allianz Group is in a principal instead of an agent role with regard to the investment fund.","In solchen Fällen qualifizieren sich Invest- mentfonds als Konzernunternehmen, wenn sich der Allianz Konzern bei den betroffenen Investmentfonds in einer Prinzipal- statt einer Agenten-Rolle befindet.",0.9012042284011841
"For certain investment funds in which the Allianz Group holds a stake of above 20 %, management has assessed that the Allianz Group has no significant influence because it is not represented in the govern- ing bodies of these investment funds or their investment activities are largely predetermined.","Bei einigen Investmentfonds, deren Anteile zu mehr als 20 % vom Allianz Konzern gehalten werden, ist das Management der Auffas- sung, dass kein maßgeblicher Einfluss auf diese Investmentfonds be- steht, da der Allianz Konzern nicht in den Leitungsorganen dieser In- vestmentfonds repräsentiert ist oder deren Kapitalanlageaktivitäten weitestgehend vorherbestimmt sind.",0.8743463158607483
"The Allianz Group also considers other factors that could provide objective evidence of a loss event, including the probability of bankruptcy and the lack of an active market due to financial difficulty.","Zusätzlich werden andere Faktoren, wie zum Beispiel die Ausfallwahrscheinlichkeit und das Fehlen eines aktiven Marktes aufgrund von finanziellen Schwierigkeiten, die objektive Hinweise auf ein Verlustereignis liefern, vom Allianz Konzern herangezogen.",0.8557028770446777
"The Allianz Group documents the hedge relationship, as well as its risk management objective and strategy for entering into the hedge trans- action.",Der Allianz Konzern dokumentiert die Sicherungsbeziehung ebenso wie seine Risikomanagementziele und die Strategie für den Abschluss der Hedge-Transaktionen.,0.8923051357269287
"For further information on derivatives, please refer to note 33.",Weitere Informationen zu den Derivaten finden sich in Angabe 33.,0.8635565042495728
These assets are initially measured at fair value plus any directly attributable transac- tion costs.,Diese Vermögenswerte werden anfänglich zum Fair Value zuzüglich der direkt zurechenbaren Transaktionskosten bewertet.,0.8657392263412476
These assets are initially measured at fair value plus any directly attributable transaction costs.,Diese Vermögenswerte werden anfänglich zum Fair Value zuzüglich der direkt zurechenbaren Transaktionskosten bewertet.,0.8632524609565735
Sales inducements on non-traditional insurance contracts are deferred and amortized using the same methodology and assumptions as for deferred acquisition costs.,Verkaufsförderungen von nicht traditionellen Versicherungsverträgen werden mit der gleichen Methode und den gleichen Annahmen wie aktivierte Abschlusskosten abgegrenzt und abgeschrieben.,0.8817636966705322
Investment contracts without discretionary participation features are accounted for as financial instruments in accordance with IAS 39.,Investmentverträge ohne ermessensabhängige Überschuss- beteiligung werden als Finanzinstrumente gemäß IAS 39 bilanziert.,0.8687680959701538
"The analyses are based on facts and circum- stances known at the time, predictions of future events, estimates of future inflation, and other societal and economic factors.","Die Analysen basieren auf aktuell bekannten Fakten und Gegebenheiten, Prognosen künftiger Ereignisse, Schätzungen der künftigen Inflations- entwicklung und weiteren sozialen und ökonomischen Faktoren.",0.9069264531135559
These valuations rely on extensive assumptions.,Diese Bewertungen basieren auf umfangreichen Annahmen.,0.9000574350357056
Further explanations and sensitivity calculations are given in note 39.,Weitere Erläuterungen und Sensitivitätsberechnungen finden sich in Angabe 39.,0.9414222836494446
"Where equity-settled plans involve equity instruments of Allianz SE, a corresponding increase in shareholders’ equity is recog- nized.","Sofern in Aktien zu erfüllende Pläne sich auf Eigenkapitalinstrumente der Allianz SE beziehen, wird die Verteilung als entsprechende Erhöhung des Eigenkapitals erfasst.",0.8757355809211731
Premiums for short-duration insurance contracts are recognized as rev- enues over the period of the contract in proportion to the amount of insurance protection provided.,Beiträge für kurzlaufende Versicherungsverträge werden über die Laufzeit der Versicherungsverträge im Verhältnis zum bereitgestellten Versicherungsschutz vereinnahmt.,0.8513115644454956
The transaction price for asset management services is determined by the fees contractually agreed.,Der Transaktionspreis für Asset Management- Leistungen wird durch die vertraglich vereinbarten Provisionen bestimmt.,0.8827874660491943
The amount is based on the best possible assessment of the tax payment expected.,Der Betrag ermittelt sich aus der besten Schätzung der erwarteten Steuerzahlung.,0.86036616563797
Contracts that had not been identified as leases under IAS 17 and IFRIC 4 were not reassessed for whether there is a lease.,"Verträge, die unter IAS 17 und IFRIC 4 nicht als Leasingverträge identifiziert wurden, werden nicht erneut daraufhin beurteilt, ob sie eine Leasingvereinbarung darstellen oder enthalten.",0.8867149353027344
The Allianz Group used the following practical expedients when applying IFRS 16 to leases previously classified as operating leases under IAS 17: Applied a single discount rate to a portfolio of leases with similar characteristics.,"Bei der Anwendung von IFRS 16 auf Leasingverträge, die zuvor gemäß IAS 17 als Mietleasingvereinbarungen klassifiziert wurden, machte der Allianz Konzern von folgenden praktischen Behelfen Gebrauch: Anwendung eines einheitlichen Diskontierungssatzes auf ein Portfolio von Leasingverträgen mit ähnlichen Merkmalen.",0.8802054524421692
The Allianz Group applied IFRS 15 Revenue from Contracts with Customers to allocate consideration in the contracts to each lease and non-lease component.,"Der Allianz Konzern wendet IFRS 15, Erlöse aus Verträgen mit Kunden, an, um das vertraglich vereinbarte Entgelt auf die Leasing- und Nichtleasingkomponenten aufzuteilen.",0.8709567189216614
"In May 2017, the IASB issued IFRS 17, Insurance Contracts.","IFRS 17, Versicherungsverträge, wurde vom IASB im Mai 2017 veröf- fentlicht.",0.9475467801094055
"The amendments to IFRS 4, Applying IFRS 9 Financial Instruments with IFRS 4 Insurance Contracts, issued in September 2016, allow enti- ties that issue insurance contracts within the scope of IFRS 4 to defer the implementation of IFRS 9 until 1 January 2021 under certain cir- cumstances.","Die im September 2016 veröffentlichten Änderungen von IFRS 4, Anwendung von IFRS 9 Finanzinstrumente gemeinsam mit IFRS 4 Ver- sicherungsverträge, erlauben es Unternehmen, die Versicherungsver- träge im Anwendungsbereich von IFRS 4 im Bestand halten, die Erst- anwendung von IFRS 9 unter bestimmten Umständen bis zum 1.",0.8664900064468384
"In this context, it is to be noted that the Exposure Draft Amendments to IFRS 17 that was published in June 2019, proposes to further extend the expiry date in IFRS 4 for the temporary exemption from applying IFRS 9 to 1 January 2022.","In diesem Zusammenhang ist zu beachten, dass der im Juni 2019 veröffentlichte Exposure Draft zu den Änderun- gen an IFRS 17 vorschlägt, das Ende der vorübergehenden Befreiung von der Anwendung von IFRS 9 in IFRS 4 weiter auf den 1.",0.8809797763824463
"Significant insurance-related liabilities are given, among others, if the percentage of the total carrying amount of liabil- ities connected with insurance relative to the total carrying amount of all liabilities is greater than 90 %.","Wesentliche Verbindlichkeiten aus dem Versicherungs- geschäft bestehen unter anderem dann, wenn der Anteil des Gesamt- buchwerts der mit dem Versicherungsgeschäft zusammenhängenden Verbindlichkeiten im Verhältnis zum Gesamtbuchwert aller Verbind- lichkeiten mehr als 90 % beträgt.",0.902470052242279
"As of 31 December 2015, the Allianz Group‘s total carrying amount of liabilities connected with insurance amounted to € 722 bn, which represented more than 90 % of its total liabilities of € 783 bn.",Dezember 2015 betrug der Gesamtbuchwert der mit dem Versicherungsgeschäft zusammenhängenden Verbindlichkeiten des Allianz Konzerns 722 Mrd €; dies entspricht mehr als 90 % der ge- samten Verbindlichkeiten von 783 Mrd €.,0.911686360836029
"Furthermore, the vast majority of the financial instruments of these subsidiaries are financial assets for unit- linked contracts that are recorded at fair value through income under IAS 39 as well as under IFRS 9.","Zudem handelt es sich bei den Finanzinstrumenten dieser Tochtergesellschaften überwiegend um finanzielle Vermögenswerte für fondsgebundene Verträge, die sowohl nach IAS 39 als auch nach IFRS 9 erfolgswirksam zum beizulegenden Zeitwert bewertet werden.",0.869219183921814
"Effective 31 December 2019, Allianz UK acquired 100 % in each Liver- pool Victoria General Insurance Group Limited (“LV GIG”) and Legal & General Insurance Limited (“LGIL”).","Dezember 2019 erwarb Allianz UK jeweils 100 % der Anteile an Liverpool Victoria General Insurance Group Limited („LV GIG"") und Legal & General Insurance Limited („LGIL"").",0.9066449403762817
"The main rationale for both acqui- sitions is to significantly increase the position of Allianz in the UK per- sonal lines and in particular in the motor and household insurance seg- ments, diversifying customer, product and distribution mix and unlock- ing synergies across Allianz businesses in the UK.","Der Haupt- grund für beide Übernahmen besteht darin, die Position der Allianz im britischen Privatkundengeschäft und insbesondere im Kfz- und Haus- haltsversicherungssegment deutlich zu stärken, den Kunden-, Produkt- und Vertriebsmix zu diversifizieren und Synergien zwischen den Allianz Geschäftsbereichen in Großbritannien zu erschließen.",0.8681244254112244
"CLASSIFICATION AS HELD FOR SALE Non-current assets and disposal groups classified as held for sale € mn As of 31 December 2019 Assets of disposal groups classified as held for sale Allianz Popular 1,884 Allianz Sakura 1,132 Other disposal groups 15 Subtotal 3,031 Non-current assets classified as held for sale Real estate held for investment 501 Real estate held for own use 23 Subtotal 524 Total 3,555 Liabilities of disposal groups classified as held for sale Allianz Popular 1,589 Allianz Sakura 637 Other disposal groups 10 Total 2,236 2018 - - 78 78 47 - 47 125 - - 62 62 Annual Report 2019 − Allianz Group D _ Consolidated Financial Statements As of 31 December 2019, all requirements were fulfilled to present Allianz Popular, Madrid, allocated to the reportable segment Iberia & Latin America (Life/Health), as a disposal group classified as held for sale.","KLASSIFIZIERUNG ALS ZUR VERÄUßERUNG GEHALTEN Langfristige Vermögenswerte und Veräußerungsgruppen, die als zur Veräußerung gehalten klassifiziert sind 2019 2018 Allianz Popular 1 884 - Allianz Sakura 1 132 - Übrige Veräußerungsgruppen 15 78 Zwischensumme 3 031 78 Fremdgenutzter Grundbesitz 501 47 Eigengenutzter Grundbesitz 23 - Zwischensumme 524 47 3 555 125 Allianz Popular 1 589 - Allianz Sakura 637 - Übrige Veräußerungsgruppen 10 62 2 236 62 Vermögenswerte von Veräußerungsgruppen, die als zur Langfristige Vermögenswerte, die als zur Veräußerung Verbindlichkeiten von Veräußerungsgruppen, die als zur Zum 31.",0.8516728281974792
"ALLIANZ SAKURA MULTIFAMILY LUX SCSP, LUXEMBOURG As of 31 December 2019, all requirements were fulfilled to present Allianz Sakura Multifamily Lux SCSp, Luxembourg, allocated to the re- portable segments German Speaking Countries and Central & Eastern Europe (Life/Health) and Corporate and Other, as a disposal group classified as held for sale.","Dezember 2019 waren alle Voraussetzungen erfüllt, die Allianz Sakura Multifamily Lux SCSp, Luxemburg, die den berichts- pflichtigen Segmenten German Speaking Countries and Central & Eastern Europe (Leben/Kranken) und Corporate und Sonstiges zuge- ordnet ist, als Veräußerungsgruppe zu zeigen.",0.8616713881492615
The closing of the transaction is expected during the first half year of 2020.,Der Abschluss der Transaktion wird für das erste Halbjahr 2020 erwartet.,0.9102411270141602
"The business activities of the Allianz Group are organized by product and type of service: insurance activities, asset management activities, and corporate and other activities.","Die geschäftlichen Aktivitäten des Allianz Konzerns sind nach Produkten und Art der Dienstleistung untergliedert in Versicherung, Asset Ma- nagement und Corporate und Sonstiges.",0.8739359378814697
"In accordance with the responsibilities of the Board of Management, each of the insurance business segments is grouped into the following reportable segments: German Speaking Countries and Central & Eastern Europe, Western & Southern Europe and Asia Pacific, Iberia & Latin America and Allianz Partners, Global Insurance Lines & Anglo Markets, Middle East and Africa.","In Übereinstimmung mit den Zuständigkei- ten der Mitglieder des Vorstands ist jeder der Versicherungsgeschäfts- bereiche in die folgenden berichtspflichtigen Segmente unterteilt: German Speaking Countries and Central & Eastern Europe, Western & Southern Europe and Asia Pacific, Iberia & Latin America and Allianz Partners, Global Insurance Lines & Anglo Markets, Middle East and Africa.",0.8998936414718628
Both asset management as well as corporate and other activities represent separate reportable segments.,Sowohl die Aktivitäten im Asset Management als auch in Corporate und Sonstiges bilden separate berichtspflichtige Segmente.,0.9157461524009705
"Furthermore, it includes the banking activities in France, Italy, and Bulgaria, global alternative investment management services in the real estate sector, mainly on behalf of the Allianz Group’s insurance operations, as well as digital investments.","Des Weiteren enthält es die Bankaktivitäten in Frankreich, Italien und Bulgarien sowie, Geschäftsbericht 2019 − Allianz Konzern hauptsächlich für die Versicherer des Allianz Konzerns, globale Alterna- tive-Investment-Management-Dienstleistungen im Bereich Immobi- lien; dazu sind digitale Investments enthalten.",0.8879435062408447
Transactions between reportable segments are eliminated in the consolidation.,Transaktionen zwischen berichtspflichtigen Segmenten werden in der Konsolidierung eliminiert.,0.8990818858146667
Financial information is recorded based on reportable segments; cross-segmental country- specific information is not determined.,Finanzinformationen werden auf Basis der berichtspflichtigen Segmente erfasst; segmentübergreifende länder- spezifische Informationen werden nicht erhoben.,0.9184374213218689
"Due to the immateriality of the former reportable segments Banking and Alternative Investments, they were combined in 2019 with the for- mer reportable segment Holding & Treasury to form the new reporta- ble segment Corporate and Other, which is identical to the respective business segment.",Aufgrund der Unwesentlichkeit der bisherigen berichtspflichtigen Seg- mente Bankgeschäft und Alternative Investments wurden diese in 2019 mit dem bisherigen berichtspflichtigen Segment Holding & Trea- sury zu dem neuen berichtspflichtigen Segment Corporate und Sonsti- ges zusammengefasst.,0.8549612164497375
Previously reported information has been adjusted to reflect this change.,"Um diese Veränderung widerzuspiegeln, wurden die bisher berichteten Informationen rückwirkend angepasst.",0.8792716860771179
Prior year figures have been adjusted accordingly.,Vorjahreszahlen wurden entsprechend angepasst.,0.9405550360679626
